address,subdistrict_code,rent,deposit,Let type,Furnish Type,Coucil Tax,PROPERTY TYPE,BEDROOMS,BATHROOMS,SIZE,avg_distance_to_nearest_station,nearest_station_count,faiss_id
"Watford Way, Hendon, NW4 4TR",,850,980,,Furnished,Ask agent,Semi-Detached,7.0,4.0,Ask agent,1.0,3,2422
"Cranbrook Park, Wood Green, N22",N22,850,980,Long term,Part furnished,Ask agent,House Share,,1.0,Ask agent,0.4,3,2423
"Mellish Street, London, E14",E14,850,0,Long term,Furnished,Ask agent,,5.0,,Ask agent,0.4,3,2424
"West Lodge Avenue, London",,850,923,Long term,Unfurnished,Ask agent,House Share,1.0,1.0,Ask agent,0.5,3,2425
"Fishponds Road, London, SW17",SW17,850,0,Long term,"Furnished or unfurnished, landlord is flexible",Ask agent,House Share,1.0,2.0,Ask agent,0.6,3,2426
"Candy Street, London",,850,980,,Ask agent,Ask agent,House,1.0,,Ask agent,0.5,3,2427
"Harrowdene Road, London, HA0",HA0,850,850,Long term,Furnished,Ask agent,House Share,1.0,1.0,Ask agent,0.3,2,2428
"Gosterwood Street, London, SE8",SE8,850,0,Long term,Furnished,Ask agent,House Share,1.0,,Ask agent,0.6,3,2429
"Double Room Church Street, London",,850,850,Long term,Unfurnished,Ask agent,House Share,1.0,1.0,"1,443 sq ft",0.7,3,2430
"Campbell Road, London, E3",,850,975,Long term,Furnished,Ask agent,Flat Share,1.0,,Ask agent,0.2,3,2431
"Chiswick Terrace, London",,850,0,Long term,Furnished,Ask agent,Flat,,,Ask agent,0.3,3,2432
"Fishermans Drive, London, SE16",SE16,850,0,Long term,Furnished,Ask agent,,1.0,1.0,Ask agent,0.5,3,2433
"College Park Close, London, SE13",SE13,850,300,Short term,Furnished,Ask agent,House Share,1.0,1.0,Ask agent,0.5,3,2434
"Sidney Street, London, E1",,850,0,Long term,Ask agent,Ask agent,House Share,1.0,1.0,Ask agent,0.4,3,2435
"Campbell Road, London, E3",,850,0,Long term,Furnished,Ask agent,Flat Share,1.0,,Ask agent,0.2,3,2436
"Bisham Close, Carshalton, SM5",SM5,850,0,Long term,Ask agent,Ask agent,House Share,1.0,2.0,Ask agent,0.8,3,2437
"Finchley Lane, London, NW4",NW4,850,850,Long term,"Furnished or unfurnished, landlord is flexible",Ask agent,Studio,,1.0,Ask agent,0.8,3,2438
"Bryanston Square, Marylebone, London, W1H",W1H,19933,36800,Long term,"Furnished or unfurnished, landlord is flexible",Ask agent,Terraced,4.0,4.0,Ask agent,0.4,3,2439
"Arbus Crescent, London, HA2",HA2,850,250,Long term,Furnished,Ask agent,House Share,1.0,4.0,Ask agent,0.7,3,2440
"Worple Road, West Wimbledon, London, SW20",SW20,850,850,Long term,Furnished,Ask agent,Flat Share,1.0,1.0,Ask agent,0.5,3,2441
"High Street South, London, E6",,850,850,Long term,Furnished,Ask agent,House Share,1.0,2.0,Ask agent,0.8,3,2442
"Devonport Road, London, W12",W12,850,850,Long term,Furnished,Ask agent,House Share,1.0,1.0,Ask agent,0.3,3,2443
"Parkhurst Road, London",,850,850,Long term,Furnished,Ask agent,House Share,1.0,1.0,Ask agent,0.7,3,2444
"Stanley Road, Teddington, TW11",TW11,850,850,Long term,Unfurnished,Ask agent,House Share,1.0,4.0,Ask agent,0.6,3,2445
"Isambard Place, London, SE16",SE16,850,980,Long term,Furnished,Ask agent,House Share,1.0,4.0,Ask agent,0.3,3,2446
"The Broadway, Southgate N14 6PH",,850,2550,Long term,Ask agent,Ask agent,Garages,,,Ask agent,0.8,3,2447
"Willowbay Close, Barnet",,850,980,Long term,Furnished,Exempt,House Share,1.0,1.0,Ask agent,1.4,3,2448
"Trafalgar Road, Greenwich, SE10",SE10,850,981,Long term,Furnished,Ask agent,Flat Share,1.0,2.0,Ask agent,0.5,3,2449
"Montague Road, Hounslow, TW3",TW3,850,850,Long term,Furnished,Ask agent,Flat Share,1.0,1.0,Ask agent,0.4,3,2450
"Edenvale Road, Mitcham, CR4",CR4,850,980,Long term,Furnished,Ask agent,House Share,1.0,3.0,Ask agent,0.6,3,2451
"Sixth Avenue, London, E12",E12,850,850,Long term,Furnished,Ask agent,Flat Share,1.0,1.0,Ask agent,0.5,3,2452
"Annesley Avenue, Colindale, NW9",NW9,850,850,Long term,Furnished,Ask agent,House Share,1.0,1.0,Ask agent,0.7,3,2453
"Pinchin Street, London",,850,980,Long term,Furnished,Ask agent,House Share,3.0,1.0,Ask agent,0.4,3,2454
"Church Street, Edmonton",,850,0,Long term,"Furnished or unfurnished, landlord is flexible",Included,House Share,1.0,2.0,Ask agent,0.8,3,2455
"(First Floor Back Room) 118 Robinson Road, London",,850,0,,Ask agent,Ask agent,House Share,1.0,1.0,Ask agent,0.4,3,2456
"Torrington Place, Wapping E1W",,850,980,Long term,Furnished,Ask agent,House Share,1.0,2.0,Ask agent,0.4,3,2457
"Anerley Park, Penge, SE20",SE20,850,0,Long term,Unfurnished,Ask agent,House Share,,1.0,Ask agent,0.3,3,2458
"Dean Road, London, NW2",NW2,855,855,Long term,Furnished,Ask agent,House Share,1.0,2.0,Ask agent,0.5,3,2459
"Fountain Road, London, SW17",SW17,860,1000,Long term,Furnished,Ask agent,House Share,1.0,1.0,Ask agent,0.6,3,2460
"Scala Street, London, W1T",W1T,865,0,,Furnished,Ask agent,House of Multiple Occupation,1.0,1.0,Ask agent,0.2,3,2461
"St. German's Road, Honor Oak, SE23",SE23,867,1025,Long term,Furnished,Ask agent,House Share,,,133 sq ft,0.6,3,2462
"Holly Court,John Harrison Way, Greenwich, SE10",SE10,867,1000,Long term,Furnished,Ask agent,House Share,,,91 sq ft,0.6,3,2463
"Drake House, 14 St. George Wharf, London, SW8",SW8,3100,2475,Long term,Furnished,Ask agent,Apartment,2.0,2.0,Ask agent,0.3,3,2464
"The Ride, Brentford, TW8",TW8,867,900,Long term,Furnished,Ask agent,House Share,,,98 sq ft,0.5,3,2465
"Basil Street, SW3",SW3,867,1000,Long term,Ask agent,Ask agent,Parking,,,Ask agent,0.5,3,2466
"Ravensbourne Park, London, SE6",SE6,867,0,Long term,Furnished,Ask agent,Studio,,1.0,Ask agent,0.3,3,2467
"Tradescant House, Frampton Park Road, Hackney, E9",,867,1000,Long term,Furnished,Ask agent,House Share,,,Ask agent,0.4,3,2468
"Bedser Drive, Greenford, UB6",UB6,867,865,Long term,Furnished,Ask agent,House Share,,,140 sq ft,0.5,3,2469
"Mornington Road, Leytonstone, E11",E11,867,1000,Long term,Furnished,Ask agent,House Share,,,116 sq ft,0.5,3,2470
"Alliance Road, Plaistow, E13",E13,867,0,Long term,Furnished,Ask agent,House Share,,,Ask agent,0.8,3,2471
"Northway, Morden, SM4",SM4,870,870,Long term,Furnished,Ask agent,House Share,1.0,1.0,Ask agent,0.6,3,2472
"Sidney Street, London, E1",,870,0,Long term,Furnished,Ask agent,Apartment,,1.0,Ask agent,0.4,3,2473
"Beaufort Avenue, Harrow",,875,0,Long term,Furnished,Included,House Share,1.0,1.0,Ask agent,0.8,3,2474
"Searles Road, London, SE1",SE1,875,1009,Long term,Furnished,Ask agent,House Share,,,Ask agent,0.6,3,2475
"Matilda House, St Katherines Way, London, E1W",E1W,875,0,Long term,Ask agent,Ask agent,Flat Share,1.0,1.0,Ask agent,0.5,3,2476
"Gosterwood Street, London, SE8",SE8,875,0,Long term,Furnished,Ask agent,,,,Ask agent,0.6,3,2477
"Hampden Road, London, N8",,875,0,Long term,"Furnished or unfurnished, landlord is flexible",Ask agent,Studio,,,Ask agent,0.4,3,2478
"Stirling Way, Borehamwood, Hertfordshire, WD6",WD6,875,0,Long term,Unfurnished,Ask agent,Studio,,1.0,409 sq ft,2.0,3,2479
"Queensberry Place, London, E12",E12,875,875,Long term,Furnished,Ask agent,Flat Share,1.0,2.0,Ask agent,0.4,3,2480
"Church Road, Northolt, UB5",UB5,875,875,Long term,Furnished,Ask agent,House Share,1.0,6.0,Ask agent,0.9,3,2481
"Aylmer Road, London, E11",E11,875,875,Long term,Furnished,Ask agent,Studio,,1.0,Ask agent,0.5,3,2482
"Limehouse, London, E14 7RA",,875,1025,Long term,Ask agent,Ask agent,House Share,1.0,1.0,Ask agent,0.7,3,2483
"Mount Road, Hayes, UB3",UB3,875,404,Long term,Furnished,Ask agent,House Share,1.0,1.0,Ask agent,1.5,3,2484
"Greyhound Lane, Streatham, London, UK, SW16 5NP",,875,1000,Long term,Furnished,Ask agent,Flat Share,1.0,1.0,Ask agent,0.5,3,2485
"Maida Vale, London, W9",,875,875,Long term,Furnished,Ask agent,Flat Share,1.0,2.0,Ask agent,0.3,3,2486
"Mollison Way, Edgware",,875,875,Long term,Furnished,Ask agent,House Share,,1.0,Ask agent,0.7,3,2487
"Francis Road, Harrow",,875,0,Long term,Furnished,Ask agent,Studio,,,Ask agent,0.5,3,2488
"Room 2, Mead Road, Edgware, HA8",HA8,875,875,Long term,Furnished,Ask agent,House Share,1.0,1.0,Ask agent,0.6,3,2489
"Clitheroe Avenue, Harrow, HA2",HA2,875,606,Long term,"Furnished or unfurnished, landlord is flexible",Ask agent,House Share,1.0,2.0,Ask agent,0.7,3,2490
"Old Oak Lane, London",,875,875,Long term,Furnished,Ask agent,House Share,,,Ask agent,0.4,3,2491
"Scales Road London, London",,876,875,,Ask agent,Ask agent,House,1.0,,Ask agent,0.4,3,2492
"Lynton Road, Lnyton Road, SE1",SE1,877,977,Long term,Furnished,Ask agent,House Share,1.0,2.0,Ask agent,0.8,3,2493
"Fountain Place, Fountain Place, SW9",SW9,877,877,Long term,Furnished,Ask agent,House Share,1.0,2.0,Ask agent,0.6,3,2494
"Hereford Street, Bethnal Green, E2",,888,1025,Long term,Furnished,Ask agent,House Share,,,75 sq ft,0.4,3,2495
"Pointers Close, Island Gardens, E14",E14,888,1025,Long term,Furnished,Ask agent,House Share,,,105 sq ft,0.4,3,2496
"Farley Road, Catford, SE6",SE6,888,1025,Long term,Furnished,Ask agent,House Share,,,122 sq ft,0.6,3,2497
"Manchester Road, Canary Wharf, E14",E14,888,1025,Long term,Furnished,Ask agent,House Share,,,109 sq ft,0.4,3,2498
"MacKenzie Close,White City Estate, White City, W12",W12,888,1025,Long term,Furnished,Ask agent,House Share,,,183 sq ft,0.5,3,2499
"Elswick Road, Lewisham, SE13",SE13,888,875,Long term,Furnished,Ask agent,House Share,,,136 sq ft,0.2,3,2500
"Ollerton Green, Bow, E3",,888,0,Long term,Furnished,Ask agent,House Share,,,119 sq ft,0.6,3,2501
"Capstan Square, Crossharbour,South Quay, E14",E14,888,1000,Long term,Furnished,Ask agent,House Share,,,95 sq ft,0.4,3,2502
"Manchester Road, Island Gardens, E14",E14,888,925,Long term,Furnished,Ask agent,House Share,,,120 sq ft,0.4,3,2503
"Lucas Avenue, Harrow, HA2",HA2,890,890,Long term,Furnished,Ask agent,House Share,1.0,6.0,Ask agent,0.7,3,2504
Sedona House,,3465,0,,Furnished,Ask agent,Apartment,3.0,2.0,"1,016 sq ft",0.4,3,2505
"Leigham Vale Streatham, London, SW16",SW16,890,890,Long term,Furnished,Ask agent,House Share,1.0,2.0,Ask agent,0.6,3,2506
"Great West Road, Isleworth, TW7",TW7,890,890,Long term,Furnished,Ask agent,House Share,1.0,6.0,Ask agent,0.4,3,2507
"Roche House, Beccles street, London, E14 8HE",,893,0,Long term,Part furnished,Ask agent,Flat Share,1.0,,Ask agent,0.3,3,2508
"Coleridge Road, London, N4",,895,1033,Long term,Furnished,Ask agent,House Share,1.0,1.0,Ask agent,0.4,3,2509
"Milton Ave, NW90EU",,895,1032,Long term,Furnished,Ask agent,Studio,,1.0,Ask agent,0.8,3,2510
"Balfour Road, Hounslow, TW3",TW3,895,895,Long term,Furnished,Ask agent,House of Multiple Occupation,1.0,1.0,Ask agent,0.4,3,2511
"Russia Dock Road, London, SE16",SE16,895,0,Long term,Furnished,Ask agent,,,,Ask agent,0.6,3,2512
"Coleridge Road, Finsbury Park, London, N4",,895,1037,Long term,Furnished,Ask agent,Terraced,1.0,1.0,Ask agent,0.4,3,2513
"Crown Lane, Morden, SM4",SM4,895,895,Long term,Furnished,Ask agent,House Share,1.0,2.0,Ask agent,0.3,3,2514
"Peckham, London, SE15",SE15,899,899,Long term,Furnished,Ask agent,Flat Share,1.0,3.0,Ask agent,0.6,3,2515
"Grange Park Road, London, E10",E10,900,900,Long term,"Furnished or unfurnished, landlord is flexible",Ask agent,House of Multiple Occupation,1.0,,Ask agent,0.7,3,2516
"Peckham Park Rd, London, SE15",SE15,900,900,Long term,Unfurnished,Ask agent,House Share,1.0,2.0,Ask agent,0.7,3,2517
"Hanworth Road, Hounslow, TW4",TW4,900,900,Long term,Furnished,Ask agent,House Share,1.0,1.0,Ask agent,0.8,3,2518
"Searles Road, London, SE1",SE1,900,1038,Long term,Furnished,Ask agent,House Share,,,Ask agent,0.6,3,2519
"10 Hospital Way, London, Greater London, SE13, SE13",SE13,900,1038,,Unfurnished,Exempt,Semi-Detached,1.0,1.0,"1,395 sq ft",0.7,3,2520
"Hospital Way, Hither Green, London, SE13 6UF",,900,1038,Long term,Unfurnished,Exempt,Semi-Detached,1.0,1.0,"1,266 sq ft",0.7,3,2521
"Island Road, Surrey Quays, SE16",SE16,900,900,Long term,Furnished,Ask agent,House Share,,1.0,Ask agent,0.4,3,2522
"Hayne Road, Beckenham, London, BR3",BR3,900,0,Long term,Unfurnished,Ask agent,Studio,,1.0,Ask agent,0.4,3,2523
"Bewley Court, 176 Brixton Hill, London, SW2",SW2,900,1038,,Ask agent,Ask agent,Flat Share,2.0,1.0,Ask agent,0.9,3,2524
"Archway, London, N19",N19,900,900,Long term,Furnished,Ask agent,Flat Share,1.0,1.0,Ask agent,0.4,3,2525
Osidge lane,,900,1038,Long term,Unfurnished,Ask agent,Studio,,1.0,Ask agent,0.9,3,2526
"Wellington Road, Harrow Wealdstone",,900,0,Long term,Furnished,Included,House Share,1.0,,Ask agent,0.8,3,2527
"Flat 13, 219 Baker Street, London, NW1",NW1,10375,0,Long term,Furnished,Ask agent,Apartment,4.0,1.0,"1,640 sq ft",0.3,3,2528
"Percy Road, Twickenham, TW2",TW2,900,1038,Long term,"Furnished or unfurnished, landlord is flexible",Ask agent,House Share,,1.0,Ask agent,0.7,3,2529
Double Room In Sudbury Town,,900,900,Long term,Furnished,Ask agent,Flat,1.0,1.0,Ask agent,0.4,3,2530
"Sorrento Road, Sutton, SM1",SM1,900,1038,Long term,Furnished,Ask agent,House Share,1.0,1.0,Ask agent,0.5,3,2531
"Stratford, London, E15",E15,900,415,Long term,Furnished,Ask agent,Flat Share,1.0,1.0,Ask agent,0.6,3,2532
"Friary Estate, London, SE15",SE15,900,0,Long term,Furnished,Ask agent,,,,Ask agent,0.7,3,2533
"Church Road, London, NW10",NW10,900,1038,Long term,Unfurnished,Ask agent,Flat Share,1.0,2.0,Ask agent,0.7,3,2534
"Greencroft Road, Hounslow, TW5",TW5,900,1000,Long term,Furnished,Ask agent,House Share,1.0,1.0,Ask agent,0.7,3,2535
"High Street, Wanstead",,900,1038,Long term,Unfurnished,Ask agent,House Share,1.0,1.0,Ask agent,0.4,3,2536
"Foxborough Gardens, London, SE4",SE4,900,0,Long term,Unfurnished,Ask agent,Flat Share,1.0,,Ask agent,0.5,3,2537
"Askew Road, Shepherds Bush",,900,1038,Long term,Part furnished,Ask agent,Flat,,1.0,259 sq ft,0.5,3,2538
"West Lodge Avenue, London",,900,1096,Long term,Unfurnished,Ask agent,House Share,1.0,1.0,Ask agent,0.5,3,2539
"Green Lanes, London, N4",,900,0,Long term,Part furnished,Ask agent,House of Multiple Occupation,1.0,,Ask agent,0.4,3,2540
"Beaford Grove, London",,900,0,Long term,Ask agent,Ask agent,House Share,1.0,1.0,Ask agent,0.4,3,2541
"Cranwood Street, Shoreditch, EC1V",EC1V,900,900,Long term,Furnished,Exempt,House Share,1.0,1.0,Ask agent,0.4,3,2542
"Harford Mews, London, N19",N19,900,900,Long term,Furnished,Ask agent,House Share,1.0,3.0,Ask agent,0.4,3,2543
"Taunton Avenue, Hounslow, TW3",TW3,900,1038,Long term,Furnished,Ask agent,Semi-Detached,,1.0,Ask agent,0.4,3,2544
"Mayow Road, Sydenham, SE26",SE26,900,0,Long term,Furnished,Ask agent,House Share,,,Ask agent,0.6,3,2545
"Park Road, London, SE25",SE25,900,0,Long term,Furnished,Ask agent,House Share,1.0,2.0,Ask agent,0.5,3,2546
"Clifton Road, Greenford",,900,1038,Long term,Ask agent,Ask agent,House Share,1.0,1.0,Ask agent,0.9,3,2547
"Oak Hill, Woodford Green",,900,0,Long term,Furnished,Ask agent,Studio,,1.0,Ask agent,0.9,3,2548
"Lillie Road, West Brompton, Fulham, London, SW6",SW6,900,1153,Long term,Furnished,Ask agent,,,5.0,Ask agent,0.3,3,2549
"Bowditch, London SE8",,900,1038,Long term,Furnished,Ask agent,Flat Share,1.0,2.0,Ask agent,0.8,3,2550
"Tyers Street, London SE11",,900,1038,Long term,Part furnished,Ask agent,House Share,1.0,,Ask agent,0.5,3,2551
"Church Road, London, E10",E10,900,900,Long term,Furnished,Ask agent,House Share,1.0,1.0,Ask agent,0.7,3,2552
"12 Hospital Way, London, Greater London, SE13, SE13",SE13,900,1038,,Unfurnished,Exempt,Semi-Detached,6.0,6.0,"1,395 sq ft",0.7,3,2553
All Bills & Wifi Included Double Room in E17,,900,0,Long term,Furnished,Ask agent,House Share,,2.0,Ask agent,0.5,3,2554
"Forest View Road, Walthamstow E17",,900,1038,Long term,Furnished,Ask agent,House Share,1.0,2.0,Ask agent,1.0,3,2555
"Alexandra Road, Hounslow, TW3",TW3,900,900,Long term,Furnished,Ask agent,House Share,1.0,1.0,Ask agent,0.4,3,2556
"London, London, E14",E14,900,900,Long term,Furnished,Ask agent,House Share,1.0,2.0,Ask agent,0.4,3,2557
"Fulham Palace Road,  London, W6",,900,1040,Long term,Furnished,Ask agent,Terraced,,2.0,Ask agent,0.4,3,2558
"Hospital Way, Hither Green, Lewisham, SE13",SE13,900,1038,,Part furnished,Exempt,Semi-Detached,1.0,1.0,"1,395 sq ft",0.7,3,2559
DOUBLE ROOM near Preston Road,,900,900,Long term,Furnished,Ask agent,,1.0,1.0,Ask agent,0.7,2,2560
"Carlton Terrace, Great Cambridge Road, Edmonton",,900,1038,Long term,Furnished,Ask agent,House Share,1.0,,Ask agent,0.9,3,2561
"Monkleigh Road, London, SM4",SM4,900,900,Long term,Furnished,Ask agent,House Share,1.0,2.0,Ask agent,0.6,3,2562
"Clifton Road, Greenford",,900,1038,Long term,Ask agent,Ask agent,House Share,1.0,1.0,Ask agent,0.8,3,2563
"Russia Dock Road, London, SE16",SE16,900,0,Long term,Furnished,Ask agent,,5.0,3.0,Ask agent,0.6,3,2564
"Room 5S, Avalon Road, W13",W13,900,0,Short term,Furnished,Ask agent,House Share,1.0,1.0,40 sq ft,0.6,3,2565
"Great Cambridge Road, London, N18",N18,900,900,Long term,Furnished,Ask agent,House Share,1.0,4.0,Ask agent,0.9,3,2566
"Putney High Street, Putney",,900,0,Long term,"Furnished or unfurnished, landlord is flexible",Ask agent,Studio,,,Ask agent,0.4,3,2567
"Rose Bates Drive, London, NW9",NW9,900,900,Long term,"Furnished or unfurnished, landlord is flexible",Ask agent,House Share,1.0,1.0,Ask agent,0.6,3,2568
"Brunswick Avenue, New Southgate",,900,0,Long term,Furnished,Included,House Share,,,Ask agent,0.9,3,2569
"Derby Road, Croydon, CR0",CR0,900,900,Long term,Furnished,Ask agent,House Share,1.0,1.0,Ask agent,0.2,3,2570
"Onslow Gardens, South Kensington, London, SW7",SW7,6478,8970,Long term,Unfurnished,Ask agent,Apartment,2.0,2.0,Ask agent,0.4,3,2571
"Earls Court Road, Earls Court",,1025,0,Long term,Furnished,Ask agent,House Share,,,Ask agent,0.3,3,2572
"London, London, SW5",SW5,1100,1100,Long term,Furnished,Ask agent,House Share,1.0,2.0,Ask agent,0.4,3,2573
"Wrights Lane, London, W8",,1105,1275,Long term,Furnished,Ask agent,Studio,,1.0,Ask agent,0.4,3,2574
"West Cromwell Road, Earls Court, London SW5",,1170,1350,,Furnished,Ask agent,Studio,,,Ask agent,0.4,3,2575
"Marloes Road, Kensington, London, W8",,1235,1425,Long term,Furnished,Ask agent,Studio,,1.0,130 sq ft,0.4,3,2576
"Kenway Road, Earls Court, London, SW5",SW5,1250,1442,Long term,Furnished,Ask agent,Studio,,1.0,129 sq ft,0.3,3,2577
"Individual Lock Up Garage, South Steps, Albert Court SW7",,1271,0,Long term,Unfurnished,Ask agent,Garages,,,Ask agent,0.5,3,2578
"22, Penywern Road, Earl's Court, SW5",SW5,1300,0,Long term,Furnished,Ask agent,Studio,,1.0,Ask agent,0.3,3,2579
"Collingham Road, SW5",SW5,1300,1500,Long term,Furnished,Ask agent,Studio,,1.0,Ask agent,0.4,3,2580
"Courtfield Gardens, South Kensington",,1300,1500,Long term,Furnished,Ask agent,Studio,,1.0,Ask agent,0.3,3,2581
"Collingham Road,  London, SW5",SW5,1300,1500,,Ask agent,Ask agent,Studio,,1.0,Ask agent,0.4,3,2582
"Prince Of Wales Terrace, London, W8",,13867,16000,Long term,Ask agent,Ask agent,Flat,2.0,2.0,854 sq ft,0.5,3,2583
"Collingham Place, Earls Court, London, SW5",SW5,1300,1500,Long term,Furnished,Ask agent,Studio,,1.0,191 sq ft,0.3,3,2584
"Collingham Place, South Kensington, SW5",SW5,1343,1550,,Furnished,Ask agent,Studio,,1.0,Ask agent,0.3,3,2585
"Large Bright 1 Bedroom Studio, Gloucester Road",,1343,0,Long term,Ask agent,Ask agent,Studio,,1.0,Ask agent,0.4,3,2586
"Collingham Place, Earls Court",,1343,0,Long term,Furnished,Ask agent,Flat,,1.0,Ask agent,0.3,3,2587
"Large Bright 1 Bedroom Studio, Gloucester Road",,1387,0,Long term,Ask agent,Ask agent,Detached,1.0,1.0,Ask agent,0.4,3,2588
"Kensington High Street, Kensington",,1408,0,Long term,Furnished,Ask agent,Flat,,1.0,Ask agent,0.5,3,2589
"Penywern Road, Earls Court, London",,1408,0,Long term,Furnished,Ask agent,Apartment,,1.0,Ask agent,0.3,3,2590
"Kensington High Street, Kensington, W8",,1408,0,Long term,Furnished,Ask agent,Flat,,1.0,Ask agent,0.5,3,2591
"Old Brompton Road, South Kensington, London, SW7",SW7,1408,0,Long term,"Furnished or unfurnished, landlord is flexible",Ask agent,Apartment,,1.0,Ask agent,0.4,3,2592
"Kensington High Street, High Street Kensington, London, W8",,1409,1625,Long term,Part furnished,Ask agent,Studio,,1.0,194 sq ft,0.5,3,2593
"Large Bright 1 Bedroom Studio, Gloucester Road",,1430,0,Long term,Ask agent,Ask agent,Detached,1.0,1.0,Ask agent,0.4,3,2594
"Russell Road, Kensington Olympia",,1430,0,Long term,Ask agent,Ask agent,Flat,,1.0,Ask agent,0.3,3,2595
"Russell Road, Kensington, W14",W14,1430,1650,Long term,Furnished,Ask agent,Studio,,,Ask agent,0.3,3,2596
"Courtfield Gardens, South Kensington, SW5",SW5,1430,1650,Long term,Furnished,Ask agent,Studio,,1.0,Ask agent,0.4,3,2597
Marloes Road Kensington W8,,1450,0,Long term,Furnished,Ask agent,Apartment,,1.0,Ask agent,0.3,3,2598
Marloes Road Kensington W8,,1451,0,Long term,Furnished,Ask agent,Apartment,,1.0,Ask agent,0.3,3,2599
"Marloes Road, Kensington, London, W8",,1452,1675,Long term,Furnished,Ask agent,Studio,,1.0,267 sq ft,0.3,3,2600
"Marloes Road, London, W8",,1452,0,Long term,Ask agent,Ask agent,Apartment,,,Ask agent,0.3,3,2601
"Courtfield Gardens, South Kensington, SW5",SW5,1473,1700,Long term,Furnished,Ask agent,Studio,,1.0,Ask agent,0.4,3,2602
"Cheniston Gardens, High Street Kensington, W8",,1473,1700,,Furnished,Ask agent,Studio,,,Ask agent,0.4,3,2603
"Southwell Gardens , South Kensington, SW7",SW7,1473,1700,,Furnished,Ask agent,Studio,,,Ask agent,0.4,3,2604
"Courtfield Gardens, London",,1473,0,Long term,Ask agent,Ask agent,Flat,,1.0,151 sq ft,0.4,3,2605
"Bramham Gardens, Earls Court",,1473,0,Long term,Ask agent,Ask agent,Flat,,1.0,Ask agent,0.3,3,2606
"Rosary Gardens, South Kensington, SW7",SW7,1500,1730,Long term,Furnished,Ask agent,Apartment,,1.0,Ask agent,0.4,3,2607
"Thurloe Street, 
South Kensington, SW7",SW7,3250,3750,Long term,Furnished,Ask agent,Flat,1.0,1.0,Ask agent,0.4,3,2608
"West Cromwell Road, London",,1516,700,,Ask agent,Ask agent,House,1.0,,Ask agent,0.4,3,2609
"West Cromwell Road, Earls Court, London, SW5",SW5,1517,1750,Long term,Furnished,Ask agent,Studio,,1.0,Ask agent,0.4,3,2610
"Marloes, Kensington, London, W8",,1517,1750,Long term,Furnished,Ask agent,Studio,,1.0,281 sq ft,0.3,3,2611
"Very large bright studio, Collingham Road",,1517,0,Long term,Ask agent,Ask agent,Studio,,1.0,Ask agent,0.3,3,2612
"Russell Road, Kensington, W14",W14,1517,1750,Long term,Furnished,Ask agent,Studio,,1.0,Ask agent,0.4,3,2613
"Glendower Place, London, SW7",SW7,1517,1750,Long term,Ask agent,Ask agent,Apartment,,,Ask agent,0.4,3,2614
"Emperors Gate, South Kensington, London, SW7",SW7,1517,1750,Long term,Part furnished,Ask agent,Studio,,1.0,300 sq ft,0.4,3,2615
"West Cromwell Road, Earls Court, London SW5",,1517,1750,Long term,Furnished,Ask agent,Studio,,1.0,Ask agent,0.4,3,2616
"Collingham Place, South Kensington, SW5",SW5,1517,1750,,Furnished,Ask agent,Studio,,1.0,Ask agent,0.3,3,2617
Flat 19 117 Warwick Road,,1525,1759,Long term,Furnished,Ask agent,Studio,,1.0,147 sq ft,0.3,3,2618
"Princess Beatrice House, Chelsea, London, SW10",SW10,1543,1780,Long term,Furnished,Ask agent,Apartment,,1.0,Ask agent,0.3,3,2619
"Hogarth Road, Earls Court",,1547,0,Long term,Furnished,Ask agent,Studio,,1.0,Ask agent,0.4,3,2620
Holland Road,,1551,0,Long term,Furnished,Ask agent,Apartment,,,Ask agent,0.4,3,2621
"Glendower Place, London, SW7",SW7,1560,1800,Long term,Ask agent,Ask agent,Apartment,,,Ask agent,0.4,3,2622
"Cromwell Road, Earl`s Court",,1560,1800,Long term,Furnished,Ask agent,Studio,,1.0,140 sq ft,0.3,3,2623
"Penywern Road, London",,1560,720,,Ask agent,Ask agent,House,1.0,,Ask agent,0.3,3,2624
"Princess Beatrice House, Chelsea, London, SW10",SW10,1560,0,Long term,Furnished,Ask agent,Apartment,,1.0,Ask agent,0.3,3,2625
"West Cromwell Road, London",,1560,720,,Ask agent,Ask agent,House,1.0,,Ask agent,0.4,3,2626
"Cromwell Road, London, SW7 4XF, UK",,4250,0,Long term,Furnished,Ask agent,Apartment,1.0,1.0,770 sq ft,0.3,3,2627
"Kensington High Street, Kensington, W8",,1582,1825,Long term,Furnished,Ask agent,Studio,,1.0,233 sq ft,0.4,3,2628
"De Vere Gardens, South Kensington, London, W8",,1582,1825,Long term,Furnished,Ask agent,Studio,,1.0,400 sq ft,0.5,3,2629
Palace Gate Kensington Kensington London,,1582,0,Long term,Furnished,Ask agent,Flat,1.0,1.0,Ask agent,0.4,3,2630
"Kensington High Street, Kensington, W8",,1582,1825,Long term,Furnished,Ask agent,Studio,,1.0,184 sq ft,0.4,3,2631
"Old Brompton Road, Earls Court, London, SW5",SW5,1582,1825,Long term,Furnished,Ask agent,Flat,1.0,1.0,343 sq ft,0.3,3,2632
"Penywern Road, London",,1595,1840,,Ask agent,Ask agent,Block of Apartments,1.0,1.0,Ask agent,0.3,3,2633
"Knaresborough Place, Earls Court",,1599,0,Long term,Furnished,Ask agent,Studio,,1.0,Ask agent,0.3,3,2634
"Collingham Place, Gloucester Road",,1600,0,,Furnished,Ask agent,Flat,1.0,1.0,Ask agent,0.4,3,2635
"Knaresborough Place, London, SW5",SW5,1600,1600,Long term,Furnished,Ask agent,Studio,,1.0,Ask agent,0.3,3,2636
"Wrights Lane, High Street Kensington, W8",,1603,1850,,Furnished,Ask agent,Studio,,1.0,Ask agent,0.4,3,2637
"West Cromwell Road, London",,1625,750,,Ask agent,Ask agent,House,1.0,,Ask agent,0.4,3,2638
"Collingham Place, London, SW5",SW5,1625,0,Long term,Furnished,Ask agent,Apartment,,1.0,Ask agent,0.4,3,2639
Collingham Place London SW5,,1625,0,Long term,Furnished,Ask agent,Apartment,,1.0,Ask agent,0.4,3,2640
"Philbeach Gardens, Earls Court",,1625,0,Long term,Ask agent,Ask agent,Flat,,1.0,Ask agent,0.3,3,2641
"Gloucester Road, South Kensington, London, SW5",SW5,1625,1875,Long term,Furnished,Ask agent,Studio,,1.0,191 sq ft,0.4,3,2642
"Southwell Gardens, South Kensington, SW7",SW7,1625,1875,,Furnished,Ask agent,Studio,,1.0,Ask agent,0.4,3,2643
"Campden Grove, Kensington, London, W8",,1625,0,Long term,Furnished,Ask agent,Apartment,,1.0,Ask agent,0.4,3,2644
"Collingham Place, Earls Court, SW5",SW5,1625,1875,Long term,Furnished,Ask agent,Flat,,1.0,Ask agent,0.4,3,2645
"Earls Court Road, Earls Court, London, SW5",SW5,1625,1875,Long term,Furnished,Ask agent,Apartment,1.0,1.0,Ask agent,0.4,3,2646
"West Cromwell Road, Earls Court, London, SW5",SW5,1625,0,Long term,Furnished,Ask agent,Studio,,1.0,Ask agent,0.4,3,2647
"De Vere Gardens, High Street Kensington, London, W8",,1625,1875,Long term,Furnished,Ask agent,Studio,,1.0,240 sq ft,0.5,3,2648
"High Street Kensington, Kensington W8",,1625,1875,Long term,Ask agent,Ask agent,Flat,,1.0,Ask agent,0.4,3,2649
