address,subdistrict_code,rent,deposit,Let type,Furnish Type,Coucil Tax,PROPERTY TYPE,BEDROOMS,BATHROOMS,SIZE,avg_distance_to_nearest_station,nearest_station_count,faiss_id
"Kensington Way, Borehamwood, Hertfordshire, WD6",WD6,1700,1961,Long term,Ask agent,Ask agent,Terraced,2.0,1.0,Ask agent,2.2,3,879
"Courtney House, Mulberry Close, Hendon, London, NW4",NW4,1750,2019,Long term,Part furnished,Ask agent,Apartment,2.0,1.0,Ask agent,0.9,3,880
"Gunter Grove, Chelsea, London, SW10 0UN",,2362,2725,Long term,Furnished,Ask agent,Flat,1.0,1.0,Ask agent,0.5,3,881
"Drayton Gardens, London",,4983,0,Long term,Part furnished,Ask agent,,3.0,3.0,Ask agent,0.6,3,882
"Glassworks, Greenford, Middlesex, UB6",UB6,2972,0,Long term,Furnished,Ask agent,Apartment,3.0,2.0,941 sq ft,0.6,3,883
"Agate Close, Willesden",,1898,0,Long term,Furnished,Ask agent,Flat,2.0,2.0,Ask agent,0.6,3,884
"High Street, Hounslow",,1250,1442,Long term,Furnished,Ask agent,Flat,1.0,1.0,Ask agent,0.4,3,885
"Sussex Street, 
Pimlico, SW1V",SW1V,5000,0,Long term,Unfurnished,Ask agent,House,4.0,3.0,Ask agent,0.5,3,886
"Chalkhill Road, Wembley HA9",,1625,0,Long term,Ask agent,Ask agent,Flat,2.0,1.0,832 sq ft,0.8,3,887
"Balham Grove, 
Balham, SW12",SW12,4500,6231,Long term,"Furnished or unfurnished, landlord is flexible",Ask agent,Mews,2.0,2.0,"1,360 sq ft",0.4,3,888
"Manor Gardens, Islington, N7",,1600,1846,Long term,Part furnished,Ask agent,Flat,1.0,1.0,Ask agent,0.6,3,889
"Etherley Road, West Green",,3499,4038,,Furnished,Ask agent,Terraced,5.0,2.0,Ask agent,0.7,3,890
Garden House W2,,5980,0,Long term,Furnished,Ask agent,Apartment,3.0,3.0,928 sq ft,0.3,3,891
"Redcliffe Gardens, SW10",SW10,3683,0,Long term,Ask agent,Ask agent,Flat,2.0,2.0,Ask agent,0.5,3,892
"Winchester Road, Edmonton, N9",,1400,1615,Long term,Unfurnished,Ask agent,Flat,2.0,1.0,Ask agent,0.8,3,893
"199 Gloucester Place, Baker Street (PP) NW1 6BU",,1525,0,,Furnished,Exempt,Apartment,1.0,1.0,Ask agent,0.3,3,894
"Monck Street, London, SW1P",SW1P,5490,0,Long term,Part furnished,Ask agent,Apartment,3.0,3.0,"1,615 sq ft",0.4,3,895
"Norton Road, Wembley",,2250,2597,Long term,Furnished,Ask agent,Detached Bungalow,2.0,1.0,Ask agent,0.5,3,896
"Battersea Park Road, Battersea, SW11",SW11,1495,1725,Long term,Furnished,Ask agent,Studio,,1.0,Ask agent,0.3,3,897
"UNCLE Southall, Southall, London, UB2",UB2,3115,0,Long term,Furnished,Ask agent,Apartment,3.0,2.0,Ask agent,1.2,3,898
Great Cumberland Place Marble Arch W1H,,3500,0,Long term,Furnished,Ask agent,Flat,3.0,1.0,Ask agent,0.3,3,899
"Upper Street, London, N1",,2495,0,Long term,Part furnished,Ask agent,Flat,2.0,,Ask agent,0.5,3,900
"White City Living, Cassini Apartments, Cascade Way, White City W12",,7995,0,Long term,"Furnished or unfurnished, landlord is flexible",Ask agent,Apartment,3.0,3.0,"1,523 sq ft",0.2,3,901
"Leonard Street, London, EC2A",EC2A,2145,0,Long term,Unfurnished,Ask agent,Apartment,1.0,1.0,Ask agent,0.4,3,902
"UNCLE Southall, Southall, London, UB2",UB2,1740,0,Long term,Furnished,Ask agent,Apartment,1.0,1.0,Ask agent,1.2,3,903
"Belvedere Road, London, SE1",SE1,3590,0,Long term,"Furnished or unfurnished, landlord is flexible",Ask agent,Apartment,1.0,1.0,592 sq ft,0.3,3,904
"Holloway Road, London, N19",N19,1600,0,Long term,"Furnished or unfurnished, landlord is flexible",Ask agent,Flat,1.0,1.0,Ask agent,0.3,3,905
"Penywern Road, Earls Court",,1993,0,,Ask agent,Ask agent,Flat,1.0,1.0,Ask agent,0.3,3,906
"New North Road, Islington, N1",,2167,0,,Furnished,Ask agent,Flat,2.0,2.0,718 sq ft,0.5,3,907
"Cheyne Place, London, SW3",SW3,27083,37500,Long term,Unfurnished,Ask agent,Flat,3.0,3.0,Ask agent,0.7,3,908
"Windsor Crescent, Wembley, HA9",HA9,953,1100,Long term,Furnished,Ask agent,House Share,,,160 sq ft,0.7,3,909
"UNCLE Southall, Southall, London, UB2",UB2,2300,0,Long term,Furnished,Ask agent,Apartment,2.0,2.0,Ask agent,1.2,3,910
"Westgate House, West Gate, London, W5",,1450,1673,Long term,Furnished,Ask agent,Apartment,,1.0,Ask agent,0.5,3,911
"Ravenslea Road, Balham",,2400,0,Long term,Part furnished,Ask agent,Flat,2.0,1.0,Ask agent,0.4,3,912
"UNCLE Southall, Southall, London, UB2",UB2,2050,0,Long term,Unfurnished,Ask agent,Apartment,2.0,2.0,Ask agent,1.2,3,913
"Pelham Court, 2 Bedroom Apartment - SW3 - (721sq.ft) -£930 p/w",,4030,4030,Long term,Furnished,Ask agent,Flat,2.0,2.0,Ask agent,0.4,3,914
"Beaulieu Close, Hounslow",,1500,1730,Long term,Furnished,Ask agent,Terraced,2.0,1.0,Ask agent,0.9,3,915
"Millbank Quarter, 9 Millbank, Westminster, SW1P",SW1P,3200,3692,Long term,Furnished,Ask agent,Flat,1.0,1.0,Ask agent,0.6,3,916
"Mulberry Walk, London, SW3",SW3,4333,0,Long term,Furnished,Ask agent,Apartment,2.0,2.0,Ask agent,0.7,3,917
"Abercorn Place, St Johns Wood, NW8",NW8,2150,2480,Long term,Furnished,Ask agent,Apartment,1.0,1.0,Ask agent,0.4,3,918
"Camden Street, Camden, London, NW1",NW1,4600,5307,,Ask agent,Ask agent,Apartment,4.0,2.0,Ask agent,0.3,3,919
"Maplewood Court, Ashford",,1695,1955,Long term,Furnished,Ask agent,Flat,2.0,2.0,Ask agent,1.2,3,920
Elsham Road London W14,,2500,0,Long term,Furnished,Ask agent,Apartment,2.0,1.0,Ask agent,0.4,3,921
"East Acton Lane, Acton, W3",,2000,0,Long term,Furnished,Ask agent,Apartment,1.0,1.0,Ask agent,0.6,3,922
"Kingsland Road, Haggerston, London, E8",,3500,4039,Long term,Part furnished,Ask agent,Flat,2.0,1.0,928 sq ft,0.4,3,923
"Kingsland Road, Haggerston, London, E8",,5000,1154,Short term,Ask agent,Ask agent,Flat,2.0,1.0,928 sq ft,0.4,3,924
"Frith Street, Soho, London, W1D",W1D,1582,1825,Long term,Furnished,Ask agent,Apartment,,1.0,Ask agent,0.2,3,925
Haggerston London E8,,2500,0,Long term,Furnished,Ask agent,Apartment,2.0,1.0,Ask agent,0.4,3,926
"Empire Way, Wembley",,2200,2538,Long term,Furnished,Ask agent,Apartment,2.0,1.0,679 sq ft,0.5,3,927
"Grafton Yard, Kentish Town, NW5",NW5,3358,3875,Long term,Ask agent,Ask agent,Apartment,3.0,1.0,Ask agent,0.3,3,928
"Trelawney House, Union Street London SE1",,2300,0,Long term,Furnished,Ask agent,Apartment,2.0,1.0,Ask agent,0.3,3,929
1 Bedroom flat - 2nd floor - Bulstrode Road,,1300,1500,Long term,Furnished,Ask agent,Flat,1.0,1.0,Ask agent,0.5,3,930
Fulham Park Gardens London SW6,,6000,6923,Long term,Unfurnished,Ask agent,Maisonette,4.0,3.0,Ask agent,0.5,3,931
"Leighton Grove, London, NW5",NW5,1585,0,Long term,Unfurnished,Ask agent,Flat,1.0,1.0,376 sq ft,0.5,3,932
"Holland House, Parrs Way, W6",,3700,4269,Long term,Furnished,Ask agent,Flat,2.0,2.0,Ask agent,0.5,3,933
"Catherine Street, Covent Garden, WC2B",WC2B,2232,0,,Unfurnished,Ask agent,Apartment,1.0,1.0,Ask agent,0.3,3,934
"Ormonde Terrace, London, NW8",NW8,3250,3750,Long term,Part furnished,Ask agent,Apartment,2.0,1.0,Ask agent,0.7,3,935
"Princess Mews, Belsize Park, NW3",NW3,3878,4475,Long term,Unfurnished,Ask agent,Terraced,2.0,2.0,Ask agent,0.4,3,936
"Redford Close, Feltham",,900,1038,Long term,Unfurnished,Ask agent,Studio,,1.0,Ask agent,1.2,3,937
"Glade Court, Harefield Road, Uxbridge, Middlesex UB8 1PJ",,1450,1673,Long term,Part furnished,Ask agent,Apartment,1.0,1.0,Ask agent,1.2,3,938
"Campden Hill Road, London, W8",,5893,0,Long term,Unfurnished,Ask agent,Apartment,3.0,3.0,"1,800 sq ft",0.4,3,939
"Campden Hill Road, London, W8",,5893,0,Long term,Unfurnished,Ask agent,Apartment,3.0,4.0,"1,800 sq ft",0.4,3,940
"Castletown Road, London",,1400,0,Long term,Furnished,Ask agent,Studio,,1.0,Ask agent,0.3,3,941
"Rosary Gardens, South Kensington, London, SW7",SW7,8212,11370,Long term,Furnished,Ask agent,Flat,3.0,3.0,Ask agent,0.4,3,942
"Lloyd Baker Street, Bloomsbury / Clarkenwell WC1X",,1777,2050,Long term,Furnished,Ask agent,Flat,1.0,1.0,Ask agent,0.4,3,943
"Sherbrooke Road, 
Fulham, SW6",SW6,4500,5192,Short term,Unfurnished,Ask agent,House,3.0,2.0,Ask agent,0.6,3,944
"Sherringham, Queensmead, St Johns Wood, london",,2500,2884,Long term,Ask agent,Ask agent,Flat,2.0,2.0,958 sq ft,0.3,3,945
"Azalea House, Feltham",,1500,1731,Long term,Furnished,Ask agent,Apartment,2.0,2.0,Ask agent,1.1,3,946
"EH -  Kenway Road,  Kenway Road, Earls Court, London, SW5",SW5,1650,1905,Long term,Furnished,Ask agent,Studio,,1.0,248 sq ft,0.3,3,947
"Headstone Road, Harrow, Middlesex, HA1",HA1,2684,0,Long term,Furnished,Ask agent,Apartment,2.0,2.0,980 sq ft,0.5,3,948
"Fountain House, The Boulevard, SW6",SW6,6000,0,Long term,Furnished,Ask agent,Apartment,3.0,3.0,Ask agent,0.5,3,949
"The Factory, Memorial Avenue, Slough, Berkshire, SL1",SL1,2100,2423,Long term,"Furnished or unfurnished, landlord is flexible",Ask agent,Apartment,2.0,2.0,Ask agent,1.5,3,950
"Clevedon Road, Twickenham, Middlesex, TW1",TW1,4750,0,Long term,Unfurnished,Ask agent,Flat,2.0,,"1,335 sq ft",0.8,3,951
"Fernshaw Road, Chelsea SW10",,2999,0,Long term,Unfurnished,Ask agent,Flat,2.0,1.0,Ask agent,0.5,3,952
"Rainham Close, SW11",SW11,3142,0,Long term,Furnished,Ask agent,House,3.0,1.0,Ask agent,0.7,3,953
"Duke Street, London, W1K",W1K,28166,0,Long term,"Furnished or unfurnished, landlord is flexible",Ask agent,Apartment,3.0,3.0,Ask agent,0.2,3,954
"281 Kennington Lane, London, London",,3200,3404,Long term,Furnished,Ask agent,Apartment,2.0,2.0,Ask agent,0.4,3,955
"Wellesley Road, Harrow",,1775,2048,Long term,Unfurnished,Ask agent,Flat,2.0,1.0,Ask agent,0.5,3,956
"Old Brompton Road, South Kensington, SW7",SW7,3250,3750,Long term,Furnished,Ask agent,Flat,2.0,2.0,Ask agent,0.4,3,957
"Durnsford House, Durnsford Road, SW19",SW19,2250,0,Long term,Furnished,Ask agent,Apartment,2.0,1.0,Ask agent,0.5,3,958
"Rehearsal Rooms, 3 Victoria Road, London, W3",,2400,0,Long term,Furnished,Ask agent,Flat,2.0,2.0,840 sq ft,0.5,3,959
"Windsor Close, Northwood, Greater London, HA6",HA6,1600,1600,Long term,Unfurnished,Ask agent,Maisonette,2.0,1.0,Ask agent,0.8,3,960
"Arundel Lodge, Salisbury Avenue, Finchley, London, N3",,1800,2076,Long term,Furnished,Ask agent,Apartment,2.0,1.0,689 sq ft,0.8,3,961
"Star Road, Isleworth",,900,1,Long term,Furnished,Ask agent,House Share,1.0,,Ask agent,0.5,3,962
"Acton Lane, Chiswick",,2297,0,Long term,Ask agent,Ask agent,Flat,2.0,2.0,Ask agent,0.4,3,963
"Philbeach Gardens, London, SW5",SW5,4350,5020,Long term,Furnished,Ask agent,Flat,2.0,2.0,861 sq ft,0.3,3,964
"Earls Terrace, Kensington, W8",,3000,3461,Long term,Furnished,Ask agent,Apartment,1.0,1.0,Ask agent,0.5,3,965
"Victoria Street, Westminster, London, SW1H",SW1H,2795,3225,Long term,Furnished,Ask agent,Flat,1.0,1.0,Ask agent,0.3,3,966
"Willoughby Road, Hampstead, NW3",NW3,2150,2480,Long term,Part furnished,Ask agent,Apartment,1.0,1.0,Ask agent,0.4,3,967
"Frithville Gardens, London, W12",W12,2000,2307,Long term,Ask agent,Ask agent,Flat,1.0,1.0,Ask agent,0.2,3,968
"Bridges Wharf, London SW11",,2201,2539,Long term,Furnished,Ask agent,Apartment,1.0,1.0,574 sq ft,0.6,3,969
"Philbeach Gardens, London, SW5",SW5,1680,1940,Long term,Furnished,Ask agent,Studio,,1.0,323 sq ft,0.3,3,970
"Church Stretton Road, Hounslow",,1100,0,Long term,Furnished,Ask agent,Studio,,1.0,Ask agent,0.7,3,971
"Pinewood Gardens, Teddington, Middlesex, TW11",TW11,4015,4632,Long term,Unfurnished,Ask agent,Apartment,3.0,2.0,Ask agent,0.9,3,972
"The Residence, London SW11",,3358,3875,Long term,Furnished,Ask agent,Apartment,2.0,1.0,Ask agent,0.4,3,973
"Old Brompton Road, South Kensington, London, SW7",SW7,1235,0,Long term,"Furnished or unfurnished, landlord is flexible",Ask agent,Apartment,,1.0,Ask agent,0.4,3,974
"Queens Gate Mews, 
Kensington Gate, SW7",SW7,16445,22770,Long term,Furnished,Ask agent,Mews,5.0,5.0,"2,789 sq ft",0.5,3,975
"Drayton Court, NW4",NW4,1990,2296,Long term,Unfurnished,Ask agent,Flat,2.0,2.0,Ask agent,1.0,3,976
"Theobalds Road, London, WC1X 8PF, UK",,4280,0,,Furnished,Ask agent,Apartment,1.0,1.0,538 sq ft,0.3,3,977
"Hamond Square, N1",,2500,2535,Long term,Furnished,Ask agent,Flat,2.0,,Ask agent,0.4,3,978
"Eastfields Avenue, London, SW18",SW18,2700,0,,Furnished,Ask agent,Apartment,2.0,2.0,786 sq ft,0.6,3,979
"295 Kingsland Road, Haggerston, E8",,3250,0,Long term,Unfurnished,Ask agent,Duplex,2.0,1.0,916 sq ft,0.4,3,980
"Old Court Place, London, W8",,5980,7500,Long term,Ask agent,Ask agent,Apartment,4.0,2.0,"1,290 sq ft",0.4,3,981
Holloway Road Islington N7,,2680,0,Long term,Part furnished,Ask agent,Apartment,2.0,2.0,Ask agent,0.3,3,982
"Bedford Road, London",,2450,0,Long term,Furnished,Ask agent,Flat,2.0,1.0,Ask agent,0.3,3,983
"Catherine Place, Harrow, HA1",HA1,1850,0,Long term,Unfurnished,Ask agent,Apartment,2.0,2.0,Ask agent,0.5,3,984
Old London Road Kingston Upon Thames KT2,,1798,0,Long term,Furnished,Ask agent,Studio,,1.0,Ask agent,0.5,3,985
"Charles Clowes Walk, LONDON",,4324,0,Long term,"Furnished or unfurnished, landlord is flexible",Ask agent,Apartment,2.0,2.0,Ask agent,0.4,3,986
"Wheelers Drive, Ruislip, HA4",HA4,1300,1500,Long term,Unfurnished,Ask agent,End of Terrace,1.0,1.0,Ask agent,1.2,3,987
"Stucley Place, Camden, London, NW1",NW1,2500,2884,Long term,Furnished,Ask agent,Apartment,2.0,1.0,Ask agent,0.3,3,988
"Charles Clowes Walk, LONDON",,4400,0,Long term,"Furnished or unfurnished, landlord is flexible",Ask agent,Apartment,2.0,2.0,Ask agent,0.4,3,989
"Portman Square, Marylebone, London, W1H",W1H,6500,0,Long term,Ask agent,Ask agent,Apartment,2.0,1.0,Ask agent,0.4,3,990
"Westgate House, West Gate, London, W5",,1700,1961,Long term,Furnished,Ask agent,Apartment,1.0,1.0,Ask agent,0.6,3,991
"Station House, Yiewsley",,1550,1788,Long term,Furnished,Ask agent,Apartment,2.0,2.0,Ask agent,1.3,3,992
"Handel House, 89 Edgwarebury Lane, Edgware, Middx, HA8",HA8,1975,0,Long term,Furnished,Ask agent,Apartment,2.0,2.0,Ask agent,0.9,3,993
Catherine Street  WC2B,,2232,0,Long term,"Furnished or unfurnished, landlord is flexible",Ask agent,Flat,1.0,1.0,352 sq ft,0.3,3,994
"Metro Central Heights, Newington Causeway, London, SE1",SE1,1450,1560,Long term,Furnished,Ask agent,Apartment,,1.0,Ask agent,0.1,3,995
"Acacia Gardens, London",,11245,0,Long term,Unfurnished,Ask agent,House,6.0,5.0,Ask agent,0.4,3,996
"Packington Square, Angel, N1",,3000,0,Long term,Ask agent,Ask agent,Apartment,2.0,1.0,754 sq ft,0.6,3,997
"John Archer Way, Wandsworth Common",,1650,1903,Long term,Furnished,Ask agent,Flat,1.0,1.0,460 sq ft,0.7,3,998
"Erin Court,",,1400,0,Long term,Furnished,Ask agent,Flat,,1.0,Ask agent,0.5,3,999
"Aerodrome Road, Colindale, NW9 4GB – 1 Bedroom Flat",,2115,2440,Long term,Unfurnished,Ask agent,Flat,1.0,1.0,Ask agent,0.7,3,1000
"Middle Field, 
St John's Wood, NW8",NW8,12000,0,Long term,Part furnished,Ask agent,Detached,4.0,3.0,Ask agent,0.3,3,1001
"Radipole Road, 
Fulham, SW6",SW6,1900,2192,Long term,Unfurnished,Ask agent,Flat,1.0,1.0,585 sq ft,0.4,3,1002
"Routh Street, Beckton, E6",,800,923,Long term,Furnished,Ask agent,House Share,1.0,1.0,Ask agent,0.4,3,1003
Manuka Heights,,2800,0,Long term,Furnished,Ask agent,Apartment,2.0,2.0,798 sq ft,0.4,3,1004
"Abbey Street, Bermondsey",,2197,0,Long term,Furnished,Ask agent,Flat,1.0,1.0,Ask agent,0.8,3,1005
"Discovery Walk, Wapping",,2999,0,Long term,Furnished,Ask agent,Flat,3.0,1.0,786 sq ft,0.4,3,1006
"Maine Tower, 9 Harbour Way, Canary Wharf, London, E14",E14,3400,3923,Long term,Furnished,Ask agent,Apartment,2.0,2.0,943 sq ft,0.2,3,1007
"Guild House,  Rotherhithe New Road, London",,3150,3634,Long term,Furnished,Ask agent,Apartment,3.0,2.0,Ask agent,0.8,3,1008
"Oglander Road, Peckham, SE15",SE15,2300,0,Short term,Unfurnished,Ask agent,Flat,2.0,2.0,Ask agent,0.5,3,1009
"Denison House, Canary Wharf,  E14",E14,1900,2192,Long term,Furnished,Ask agent,Apartment,1.0,1.0,485 sq ft,0.3,3,1010
"Mount Adon Park, SE22",SE22,1950,2250,Long term,Furnished,Ask agent,Flat,2.0,1.0,Ask agent,0.9,3,1011
Landmark West Tower E14,,2249,2595,Long term,Ask agent,Ask agent,Flat,1.0,1.0,Ask agent,0.3,3,1012
"Comet Street, London, SE8",SE8,4250,0,,Part furnished,Ask agent,Town House,4.0,2.0,"1,798 sq ft",0.2,3,1013
"King Frederick Ninth Tower, SE16",SE16,1950,0,Long term,"Furnished or unfurnished, landlord is flexible",Ask agent,Flat,1.0,1.0,Ask agent,0.7,3,1014
"Rotherhithe Street, London",,2000,0,Long term,Furnished,Ask agent,Semi-Detached,2.0,1.0,Ask agent,0.6,3,1015
"Wager Street, Mile End Bow",,3500,4039,,Furnished,Ask agent,Apartment,4.0,1.0,Ask agent,0.5,3,1016
"Houston Road, Forest Hill, SE23 2RJ",,3000,3461,Long term,Part furnished,Ask agent,Semi-Detached,5.0,2.0,Ask agent,0.8,3,1017
Telegraph Place,,1746,2015,Long term,Part furnished,Ask agent,Detached,2.0,,Ask agent,0.3,3,1018
"Arena Tower, 25 Crossharbour Plaza, Canary Wharf, London, E14",E14,1900,2192,Long term,Furnished,Ask agent,Apartment,,1.0,366 sq ft,0.3,3,1019
St. Pauls Cray Road Chislehurst BR7,,1850,0,Long term,Unfurnished,Ask agent,Apartment,2.0,1.0,Ask agent,1.3,3,1020
"Baltimore Wharf, Canary Wharf, London, E14",E14,2300,2653,Long term,Furnished,Ask agent,Apartment,1.0,1.0,611 sq ft,0.3,3,1021
Old Kent Road Bermondsey SE1,,1500,1731,Long term,Furnished,Ask agent,Flat,1.0,1.0,Ask agent,0.8,3,1022
"Landmark East Tower, E14",E14,2200,0,Long term,Ask agent,Ask agent,Apartment,1.0,1.0,Ask agent,0.2,3,1023
"Baildon Street, Deptford, London, SE8 4BQ",,1400,1615,Long term,Part furnished,Ask agent,Flat,1.0,1.0,403 sq ft,0.2,3,1024
Providence Close (off of Wetherell road E9),,2000,2539,Long term,Unfurnished,Ask agent,Apartment,2.0,1.0,576 sq ft,0.7,3,1025
"Eastfield House, 19 Atherton Mews, London",,2500,2885,Long term,Unfurnished,Ask agent,Flat,3.0,2.0,Ask agent,0.4,3,1026
"South Boulevard, Baltimore Wharf, Canary Wharf E14",,1777,2050,Long term,Furnished,Ask agent,Studio,,1.0,Ask agent,0.3,3,1027
"St. Davids Square, London, E14",E14,2100,0,Long term,Furnished,Ask agent,Apartment,2.0,1.0,570 sq ft,0.3,3,1028
"Byards Court, Worgan Street, London",,2499,0,Long term,Furnished,Ask agent,Flat,2.0,,Ask agent,0.4,3,1029
"Baltimore Wharf, Canary Wharf, London, E14",E14,2934,0,Long term,Furnished,Ask agent,Apartment,2.0,2.0,Ask agent,0.3,3,1030
"Tower Bridge Road, London, SE1",SE1,1650,2019,Long term,"Furnished or unfurnished, landlord is flexible",Ask agent,Studio,,1.0,Ask agent,0.6,3,1031
"Old Kent Road, London, SE1",SE1,1500,0,Long term,"Furnished or unfurnished, landlord is flexible",Ask agent,Studio,,1.0,Ask agent,0.8,3,1032
"Cubitt Wharf, Isle of Dogs, E14",E14,1625,1875,Long term,Part furnished,Ask agent,Apartment,1.0,1.0,Ask agent,0.5,3,1033
"Commercial Street, London, E1 6LT, UK",,4790,0,Long term,Furnished,Ask agent,Apartment,2.0,2.0,836 sq ft,0.3,3,1034
"Buckle Street, London, E1 1LN, UK",,4190,0,Long term,Furnished,Ask agent,Apartment,2.0,1.0,945 sq ft,0.2,3,1035
"Pepper Street, London, E14 9RP, UK",,2750,0,Long term,Furnished,Ask agent,Apartment,1.0,1.0,500 sq ft,0.3,3,1036
"Dock Street, London, E1 8JP, UK",,3450,0,Long term,Furnished,Ask agent,Apartment,2.0,2.0,698 sq ft,0.3,3,1037
"Mansell Street, London, E1 8AL, UK",,2450,0,Long term,Furnished,Ask agent,Apartment,,1.0,366 sq ft,0.2,3,1038
"Eagle House, Headlam Street, London, E1",,2850,0,Long term,Furnished,Ask agent,Apartment,3.0,1.0,Ask agent,0.3,3,1039
"Tapestry Way, London, E1 2FR, UK",,3240,0,Long term,Furnished,Ask agent,Apartment,2.0,2.0,763 sq ft,0.4,3,1040
"Tapestry Way, London, E1 2FR, UK",,2430,0,Long term,Furnished,Ask agent,Apartment,1.0,1.0,432 sq ft,0.4,3,1041
"Gillender Street, London, E3 3JX, UK",,2040,0,Long term,Furnished,Ask agent,Apartment,,1.0,396 sq ft,0.4,3,1042
"Tapestry Way, London, E1 2FR, UK",,2540,0,Long term,Furnished,Ask agent,Apartment,1.0,1.0,563 sq ft,0.4,3,1043
"New Tannery Way, London, SE1 5WS, UK",,2990,0,Long term,Furnished,Ask agent,Apartment,2.0,2.0,700 sq ft,0.8,3,1044
"New Drum Street, London, E1 7AS, UK",,4540,0,Long term,Furnished,Ask agent,Apartment,3.0,2.0,905 sq ft,0.2,3,1045
"Harbour Way, London, E14 9XP, UK",,4390,0,Long term,Furnished,Ask agent,Apartment,2.0,2.0,853 sq ft,0.2,3,1046
"Baltimore Wharf, London, E14 9RE, UK",,4060,0,Long term,Furnished,Ask agent,Apartment,2.0,2.0,818 sq ft,0.3,3,1047
"Merchant House, Stratford, E20",E20,2750,0,,"Furnished or unfurnished, landlord is flexible",Ask agent,Apartment,2.0,1.0,Ask agent,0.5,3,1048
"8 Water Street, Canary Wharf, E14",E14,4397,0,,"Furnished or unfurnished, landlord is flexible",Ask agent,Flat,2.0,1.0,Ask agent,0.2,3,1049
"Newfoundland, Canary Wharf, E14",E14,2903,0,,"Furnished or unfurnished, landlord is flexible",Ask agent,Flat,1.0,1.0,Ask agent,0.2,3,1050
"Newfoundland, Canary Wharf, E14",E14,3250,0,,"Furnished or unfurnished, landlord is flexible",Ask agent,Flat,1.0,1.0,Ask agent,0.2,3,1051
"Westbury Road, Barking, IG11",IG11,2800,3230,Long term,Furnished,Ask agent,Terraced,4.0,2.0,"1,123 sq ft",0.9,3,1052
"10 George Street, Canary Wharf, E14",E14,2860,0,,"Furnished or unfurnished, landlord is flexible",Ask agent,Flat,1.0,1.0,Ask agent,0.3,3,1053
"8 Water Street, Canary Wharf, E14",E14,4052,0,,"Furnished or unfurnished, landlord is flexible",Ask agent,Flat,2.0,1.0,Ask agent,0.2,3,1054
"Newfoundland, Canary Wharf, E14",E14,4000,0,,"Furnished or unfurnished, landlord is flexible",Ask agent,Flat,1.0,1.0,Ask agent,0.2,3,1055
"Newfoundland, Canary Wharf, E14",E14,3500,0,,"Furnished or unfurnished, landlord is flexible",Ask agent,Flat,1.0,1.0,Ask agent,0.2,3,1056
"Newfoundland, Canary Wharf, E14",E14,2492,0,,"Furnished or unfurnished, landlord is flexible",Ask agent,Flat,,1.0,Ask agent,0.2,3,1057
"Merchant House, Stratford, E20",E20,3300,0,,"Furnished or unfurnished, landlord is flexible",Ask agent,Apartment,3.0,2.0,Ask agent,0.5,3,1058
"Newfoundland, Canary Wharf, E14",E14,7390,0,,"Furnished or unfurnished, landlord is flexible",Ask agent,Flat,3.0,2.0,Ask agent,0.2,3,1059
"Poplar, London, E14",E14,2200,2538,Long term,Furnished,Ask agent,Flat,2.0,1.0,Ask agent,0.4,3,1060
"Codrington Court, Rotherhithe Street, SE16",SE16,2000,2307,Long term,Part furnished,Ask agent,Apartment,2.0,2.0,731 sq ft,0.5,3,1061
Ilderton Road,,1425,0,,Furnished,Ask agent,Flat Share,,1.0,189 sq ft,0.6,3,1062
"Elmhurst, Belvedere, DA17",DA17,2150,2150,Long term,Unfurnished,Ask agent,Terraced,3.0,1.0,Ask agent,1.1,3,1063
Commercial Road,,2102,0,,Furnished,Ask agent,Studio,,1.0,151 sq ft,0.4,3,1064
"Goodrich Road, East Dulwich, London, SE22",SE22,2700,3116,Long term,"Furnished or unfurnished, landlord is flexible",Ask agent,Flat,2.0,1.0,769 sq ft,0.9,3,1065
"Westferry Circus, London",,4182,4182,Long term,Furnished,Ask agent,Apartment,2.0,2.0,Ask agent,0.3,3,1066
"Westferry Circus, London",,4247,4246,Long term,Furnished,Ask agent,Apartment,2.0,2.0,Ask agent,0.3,3,1067
"South Quay Square, London, E14 9RT, UK",,3140,0,Long term,Furnished,Ask agent,Apartment,2.0,2.0,650 sq ft,0.1,3,1068
"Riverstone Heights, 18 Reed Avenue, London, E3 3ZD",,2270,0,Long term,Furnished,Ask agent,Apartment,1.0,1.0,Ask agent,0.3,3,1069
"Pan Peninsula Square, London, E14",E14,3400,3923,Long term,Furnished,Ask agent,Flat,2.0,2.0,Ask agent,0.2,3,1070
"Stubbs Drive, London, SE16",SE16,1200,0,Long term,Furnished,Ask agent,Studio,,1.0,Ask agent,0.5,3,1071
"Thunderer Street, London, E13",E13,1250,1442,Long term,Furnished,Ask agent,Flat Share,1.0,2.0,Ask agent,0.7,3,1072
"Jubilee Court, London, SE10",SE10,1850,2135,Long term,Furnished,Ask agent,Flat,1.0,1.0,Ask agent,0.3,3,1073
"Lafone Street, London, SE1 2LT, UK",,3240,0,Long term,Furnished,Ask agent,Apartment,2.0,2.0,900 sq ft,0.6,3,1074
"Meath Crescent, London, E2",,2500,2884,Long term,Ask agent,Ask agent,Apartment,2.0,2.0,800-850 sq ft,0.4,3,1075
"Rope Street, London SE16",,4000,4615,Long term,Furnished,Ask agent,Town House,4.0,2.0,Ask agent,0.6,3,1076
"Garrick Drive, Thamesmead, London, SE28",SE28,1725,0,Long term,"Furnished or unfurnished, landlord is flexible",Ask agent,Terraced,2.0,1.0,Ask agent,0.4,3,1077
"Iceland Wharf, Plough Way, London SE16",,1300,1500,Long term,Furnished,Ask agent,Flat Share,1.0,1.0,Ask agent,0.6,3,1078
"Masters Drive, London SE16",,950,1096,Long term,"Furnished or unfurnished, landlord is flexible",Ask agent,Flat Share,1.0,1.0,Ask agent,0.6,3,1079
"Chancellor House, London, SE16",SE16,3200,3692,Long term,Furnished,Ask agent,Flat,3.0,2.0,Ask agent,0.8,3,1080
"Lee High Road, London, SE12",SE12,1850,2135,Long term,Unfurnished,Ask agent,Maisonette,2.0,1.0,Ask agent,0.6,3,1081
"Leven Road, London, E14",E14,2200,2583,Long term,Furnished,Ask agent,Flat,2.0,2.0,Ask agent,0.5,3,1082
"Strone Road, London, E7",,2500,2500,Long term,Unfurnished,Ask agent,Terraced,4.0,1.0,Ask agent,0.5,3,1083
"Elstow Road, Dagenham, RM9",RM9,1725,1990,Long term,Unfurnished,Ask agent,Terraced,2.0,1.0,Ask agent,0.7,3,1084
"Deals Gateway, Lewisham, SE13",SE13,2000,2307,Long term,Ask agent,Ask agent,Apartment,2.0,2.0,Ask agent,0.2,3,1085
"Maine Tower, E14",E14,3400,0,Long term,Furnished,Ask agent,Apartment,2.0,2.0,Ask agent,0.2,3,1086
"Riverstone Heights, 18 Reed Avenue, London, E3 3ZD",,2260,0,Long term,Furnished,Ask agent,Apartment,1.0,1.0,Ask agent,0.3,3,1087
"Tranquil Vale, London, SE3",SE3,2150,2480,Long term,Ask agent,Ask agent,Flat,2.0,1.0,Ask agent,0.6,3,1088
"Mayesbrook Road, Essex, IG3",IG3,1950,2250,Long term,Unfurnished,Ask agent,Flat,2.0,1.0,Ask agent,0.7,3,1089
"Shooters Hill, London, SE18",SE18,1800,1800,Long term,Unfurnished,Ask agent,Flat,2.0,2.0,Ask agent,1.1,3,1090
"Woolwich Road, Charlton, SE7",SE7,2200,2538,Long term,Unfurnished,Ask agent,Terraced,2.0,1.0,Ask agent,0.6,3,1091
Friern Road Dulwich SE22,,4750,5481,Long term,Unfurnished,Ask agent,Terraced,5.0,2.0,Ask agent,0.9,3,1092
"Fish Island, London, E3",,2100,2423,Long term,Furnished,Ask agent,Flat,1.0,1.0,Ask agent,0.5,3,1093
"Pan Peninsula Square, London, E14",E14,2300,2300,Long term,Furnished,Ask agent,Flat,1.0,1.0,Ask agent,0.2,3,1094
"Overcliff Road, London, SE13",SE13,4000,4615,Long term,Unfurnished,Ask agent,Terraced,5.0,3.0,Ask agent,0.4,3,1095
"Limes Grove, London, SE13",SE13,1500,1500,Long term,Unfurnished,Ask agent,Flat,1.0,1.0,Ask agent,0.5,3,1096
"Caistor Park Road, Stratford, London, E15",E15,2250,2597,Long term,Furnished,Ask agent,House,2.0,1.0,896 sq ft,0.4,3,1097
"Bancroft Road, Mile End, London, E1",,5700,6577,Long term,Unfurnished,Ask agent,Terraced,6.0,3.0,"1,270 sq ft",0.4,3,1098
