address,subdistrict_code,rent,deposit,Let type,Furnish Type,Coucil Tax,PROPERTY TYPE,BEDROOMS,BATHROOMS,SIZE,avg_distance_to_nearest_station,nearest_station_count,faiss_id
"Richard Street, Whitechapel, London",,1750,2134,Long term,Furnished,Ask agent,Apartment,1.0,1.0,Ask agent,0.4,3,1749
"Little Heath Road, Bexleyheath, Kent, DA7",DA7,3350,3865,Long term,Part furnished,Ask agent,Semi-Detached,4.0,2.0,Ask agent,1.0,3,1750
"Catalina House, 4 Canter Way, Goodman's Fields, E1",,3000,0,Long term,Furnished,Ask agent,Apartment,1.0,1.0,578 sq ft,0.2,3,1751
Cedars Road | E15,,925,1067,Long term,Part furnished,Ask agent,House Share,1.0,2.0,Ask agent,0.5,3,1752
"3 Tidal Basin Road, London, E16",E16,2500,0,Long term,Furnished,Ask agent,Apartment,2.0,2.0,Ask agent,0.4,3,1753
The Q | Stratford High Street | E15,,1600,1846,Long term,Part furnished,Ask agent,Apartment,1.0,1.0,Ask agent,0.3,3,1754
"Roden Street, Ilford, London, IG1",IG1,2050,0,Long term,Furnished,Ask agent,Apartment,2.0,2.0,667 sq ft,0.7,3,1755
"Altitude Point, E1",,6150,7096,Long term,Furnished,Ask agent,Penthouse,3.0,2.0,Ask agent,0.2,3,1756
"Dundas Court, Greenwich, SE10",SE10,2400,2769,Long term,Furnished,Ask agent,Apartment,2.0,2.0,Ask agent,0.3,3,1757
"Phoenix Heights East, E14",E14,2750,3173,Long term,Furnished,Ask agent,Apartment,2.0,1.0,Ask agent,0.2,3,1758
"Ilford Hill, Ilford, London, IG1",IG1,2100,0,Long term,Furnished,Ask agent,Apartment,2.0,2.0,716 sq ft,0.7,3,1759
"Ilford Hill, Ilford, London, IG1",IG1,2050,0,Long term,Furnished,Ask agent,Apartment,2.0,2.0,716 sq ft,0.7,3,1760
"Ilford Hill, Ilford, London, IG1",IG1,1899,0,Long term,Unfurnished,Ask agent,Apartment,2.0,2.0,716 sq ft,0.7,3,1761
"Hertsmere Road, 
Canary Wharf, E14",E14,3650,5054,Long term,Furnished,Ask agent,Flat,2.0,2.0,Ask agent,0.2,3,1762
"George Lane, Lewisham",,1550,1557,Long term,Unfurnished,Ask agent,Flat,1.0,1.0,Ask agent,0.6,3,1763
"Branch Road, E14",E14,2450,2826,Long term,Furnished,Ask agent,Apartment,2.0,2.0,Ask agent,0.5,3,1764
"Silk District, 7 Cendal Crescent, E1",,3200,3923,Long term,Ask agent,Ask agent,Flat,2.0,2.0,763 sq ft,0.4,3,1765
"Dundas Court, 29 Dowells Street, Greenwich, London, SE10",SE10,1950,2250,Long term,Furnished,Ask agent,Apartment,1.0,1.0,491 sq ft,0.3,3,1766
"Nova Building, Newton Place, Canary Wharf London, E14",E14,2990,0,,Furnished,Ask agent,Apartment,3.0,1.0,Ask agent,0.6,3,1767
"Ambassador square, Isle of dogs, Canary Wharf, London, E14",E14,6110,0,,Furnished,Ask agent,Town House,6.0,8.0,Ask agent,0.3,3,1768
"Hallings Wharf Studios, London, E15",E15,2700,3115,Long term,Furnished,Ask agent,Flat,3.0,2.0,Ask agent,0.3,3,1769
"Riverstone Heights, 18 Reed Avenue, London, E3 3ZD",,2750,0,Long term,Furnished,Ask agent,Apartment,2.0,2.0,Ask agent,0.3,3,1770
"Tudor Court, Princes Riverside Road, Rotherhithe, London, SE16",SE16,2448,2825,Long term,Furnished,Ask agent,Apartment,2.0,2.0,Ask agent,0.5,3,1771
"Hornbeam House, 22 Quebec Way, Canada Water, London, SE16",SE16,4117,4750,Long term,Furnished,Ask agent,Apartment,3.0,3.0,Ask agent,0.5,3,1772
"Talisman Tower, 6 Lincoln Plaza, Canary Wharf, E14",E14,3640,4200,Long term,Part furnished,Ask agent,Apartment,3.0,2.0,Ask agent,0.2,3,1773
"Talisman Tower, 6 Lincoln Plaza, Canary Wharf, E14",E14,3400,3923,Long term,Part furnished,Ask agent,Apartment,3.0,2.0,Ask agent,0.2,3,1774
"Cable Street, London, E1 0BL, UK",,3170,0,Long term,Furnished,Ask agent,Apartment,2.0,1.0,762 sq ft,0.4,3,1775
"Duckett Street, London, E1",,1950,2250,Long term,Furnished,Ask agent,Flat,2.0,1.0,Ask agent,0.4,3,1776
"Cassilis Road, London, E14 9LH",,1825,2105,Long term,"Furnished or unfurnished, landlord is flexible",Ask agent,Flat,1.0,1.0,482 sq ft,0.3,3,1777
"Sunlight Square, E2",,2691,3105,Long term,Furnished,Ask agent,Apartment,2.0,1.0,Ask agent,0.2,3,1778
"Aspen, Canary Wharf, E14",E14,2400,2769,Long term,Ask agent,Ask agent,Studio,,1.0,430 sq ft,0.2,3,1779
"River View Heights, 27 Bermondsey Wall West, London",,3349,3865,Long term,Furnished,Ask agent,Flat,2.0,2.0,Ask agent,0.5,3,1780
"Tideslea Path, West Thamesmead, SE28 0NA",,1550,1788,Long term,Unfurnished,Ask agent,Apartment,2.0,2.0,Ask agent,0.9,3,1781
"Sailors House, London, E14",E14,1895,2187,Long term,Furnished,Ask agent,Flat,1.0,1.0,Ask agent,0.3,3,1782
"Brockley Road, London, SE4",SE4,1600,1800,Long term,Furnished,Ask agent,Flat,2.0,1.0,Ask agent,0.4,3,1783
"Manor Way, Blackheath, London, SE3",SE3,2800,1292,Long term,"Furnished or unfurnished, landlord is flexible",Ask agent,Terraced,3.0,2.0,Ask agent,0.6,3,1784
"Harbourside Court, 1 Gullivers Walk, London, SE8",SE8,2200,2538,Long term,Furnished,Ask agent,Apartment,2.0,2.0,790 sq ft,0.7,3,1785
"Ironmongers Place, Canary Wharf,London, E14",E14,4983,0,,Furnished,Ask agent,Semi-Detached,5.0,4.0,Ask agent,0.4,3,1786
"St. Albans Avenue, London",,2300,0,Long term,Furnished,Ask agent,House,3.0,1.0,Ask agent,1.0,3,1787
"Chaucer Drive, London, SE1",SE1,2750,3173,Long term,Furnished,Ask agent,Terraced,3.0,1.0,Ask agent,0.9,3,1788
"Ferry Street, Isle of dogs, London, E14",E14,4983,0,,Furnished,Ask agent,Terraced,5.0,4.0,Ask agent,0.2,3,1789
"62 Blair Street, London, E14 0JL",,2150,0,Long term,Furnished,Ask agent,Flat,2.0,2.0,Ask agent,0.4,3,1790
"Counter House, London Dock, London, E1W",E1W,2545,0,,Furnished,Ask agent,Apartment,1.0,1.0,Ask agent,0.4,3,1791
"Napoleon Lane, London",,1600,1846,Long term,Unfurnished,Ask agent,House,1.0,1.0,Ask agent,1.1,3,1792
"Old Kent Road, London, SE1",SE1,2095,2095,Long term,Furnished,Ask agent,Flat,2.0,1.0,Ask agent,0.9,3,1793
"Old Church Road, London, E1",,2950,3404,Long term,Unfurnished,Ask agent,Maisonette,3.0,1.0,Ask agent,0.4,3,1794
"119 Sydney Road, Abbey Wood, SE2 9RY",,2400,2769,Long term,Ask agent,Ask agent,Town House,3.0,2.0,"1,312 sq ft",1.1,3,1795
Millenium Close  Custom House E16,,2150,2480,Long term,Part furnished,Ask agent,Terraced,2.0,1.0,Ask agent,0.4,3,1796
"DONALDSON ROAD, Woolwich, London, SE18",SE18,2350,2712,Long term,Unfurnished,Ask agent,Semi-Detached,3.0,1.0,"1,044 sq ft",1.2,3,1797
"Solander Gardnes, Shadwell, London, E1",,1842,2125,Long term,Unfurnished,Ask agent,Flat,2.0,1.0,600 sq ft,0.4,3,1798
"Abbey Street, Bermondsey, London, SE1",SE1,3150,3635,Long term,Part furnished,Ask agent,Flat,3.0,2.0,"1,226 sq ft",0.6,3,1799
"Haddo House, SE10",SE10,1850,2135,Long term,Unfurnished,Ask agent,Flat,2.0,1.0,Ask agent,0.1,3,1800
"Sherwood Gardens, Isle Of Dogs, London, E14",E14,1842,2125,Long term,Part furnished,Ask agent,Flat,1.0,1.0,613 sq ft,0.5,3,1801
", FALCONBROOK GARDENS, Canning Town, London, E16",E16,2400,2770,Long term,Furnished,Ask agent,Flat,1.0,,692 sq ft,0.3,3,1802
"Tidal Basin Road, E16, Royal Docks, London, E16",E16,1750,2020,Long term,Unfurnished,Ask agent,Studio,,1.0,442 sq ft,0.2,3,1803
"Leafy Oak Road, Grove Park, London, SE12",SE12,2300,2654,Long term,Unfurnished,Ask agent,Semi-Detached,3.0,1.0,874 sq ft,0.8,3,1804
"Wellsmoor Gardens, Bickley, Bromley, BR1",BR1,2500,2885,Long term,Unfurnished,Ask agent,House,3.0,1.0,"1,070 sq ft",0.7,3,1805
"Lewisham Way, New Cross, SE14",SE14,2000,2308,Long term,Unfurnished,Ask agent,Flat,2.0,1.0,Ask agent,0.4,3,1806
"Gilbert Close, Godwin House, SE18",SE18,1500,1730,Long term,Furnished,Ask agent,Apartment,1.0,,Ask agent,1.3,3,1807
"Barquentine Heights, Greenwich, SE10",SE10,2500,2885,Long term,Unfurnished,Ask agent,Apartment,2.0,1.0,Ask agent,0.7,3,1808
"Exeter Way, London, SE14",SE14,2195,2532,Long term,Ask agent,Ask agent,End of Terrace,2.0,1.0,Ask agent,0.2,3,1809
"New Cross Road, London, SE14",SE14,1400,1615,Long term,Part furnished,Ask agent,Studio,,1.0,Ask agent,0.2,3,1810
"Sunbury Court, 12 Myers Lane, New Cross, London, SE14",SE14,1200,0,Long term,Ask agent,Ask agent,Studio,,1.0,Ask agent,0.6,3,1811
"Hampton Tower, 75 Marsh Wall, Canary Wharf, London, E14",E14,2400,2769,Long term,Furnished,Ask agent,Apartment,,1.0,472 sq ft,0.2,3,1812
"Moremead Road, London, SE6",SE6,1595,0,Long term,Unfurnished,Ask agent,House,2.0,1.0,Ask agent,0.5,3,1813
"Wards Place, Canary Wharf",,2496,0,Long term,Furnished,Ask agent,Studio,,1.0,Ask agent,0.2,3,1814
"Circus Apartments, Two Bed Apartment, Canary Wharf,  E14 - £670 P/W",,2903,2903,Long term,Furnished,Ask agent,Apartment,1.0,1.0,Ask agent,0.3,3,1815
"Bridge View Court, Grange Road, London Bridge, SE1",SE1,2968,0,Long term,Furnished,Ask agent,Flat,2.0,2.0,Ask agent,0.7,3,1816
"Barrier Point, Royal Docks E16",,2383,2750,Long term,Furnished,Ask agent,Apartment,2.0,2.0,Ask agent,0.5,3,1817
"Voysey Square, London, E3",,1600,1846,Long term,Unfurnished,Ask agent,Apartment,1.0,1.0,439 sq ft,0.3,3,1818
"Royal Wharf , London, E16",E16,2300,0,Long term,Part furnished,Ask agent,Flat,2.0,2.0,Ask agent,0.5,3,1819
"Mercia Grove, London, SE13",SE13,1395,1610,Long term,"Furnished or unfurnished, landlord is flexible",Ask agent,Flat,1.0,1.0,Ask agent,0.5,3,1820
"Slippers Place, London, SE16",SE16,2200,2000,Long term,Furnished,Ask agent,Flat,3.0,1.0,Ask agent,0.3,3,1821
"Wharfside Point South, London, E14",E14,1675,1675,Long term,Furnished,Ask agent,Flat,1.0,1.0,Ask agent,0.1,3,1822
"Amory Tower (The Madison), Marsh Wall, London, E14",E14,2550,0,Long term,"Furnished or unfurnished, landlord is flexible",Ask agent,Flat,1.0,1.0,Ask agent,0.3,3,1823
"Rennets Wood Road, Eltham, SE9",SE9,1850,2134,Long term,Ask agent,Ask agent,Apartment,3.0,1.0,Ask agent,1.0,3,1824
Belfort Road London SE15,,1550,1788,Long term,Unfurnished,Ask agent,Flat,1.0,1.0,Ask agent,0.4,3,1825
"Cavatina Point, 3 Dancers Way, London, SE8",SE8,2400,0,Long term,Ask agent,Ask agent,Apartment,2.0,2.0,Ask agent,0.3,3,1826
"London Road, 26-28 London Road, Forest Hill",,1200,0,Long term,Furnished,Ask agent,,1.0,1.0,Ask agent,0.6,3,1827
"Ashbourne House, North Birkbeck Road, Leyton",,1505,1736,Long term,Furnished,Ask agent,Apartment,1.0,1.0,Ask agent,0.6,3,1828
"The Haydon, City of London, EC3N",EC3N,6000,8307,Long term,Ask agent,Ask agent,Apartment,2.0,2.0,948 sq ft,0.2,3,1829
"Thunderer Street, Upton Park",,2999,0,Long term,Unfurnished,Ask agent,Flat,3.0,2.0,Ask agent,0.7,3,1830
"Vetro Court, Salter Street, Canary Wharf, London, E14",E14,3250,0,Long term,Furnished,Ask agent,Apartment,2.0,1.0,Ask agent,0.3,3,1831
"Southmere Building, Highland Street E15",,2000,2308,Long term,Furnished,Ask agent,Apartment,1.0,1.0,Ask agent,0.3,3,1832
"Baizdon Road , Blackheath, London",,1850,2134,Long term,Furnished,Ask agent,Flat,2.0,1.0,Ask agent,0.6,3,1833
"Windsor Square, SE18",SE18,2850,0,Long term,Furnished,Ask agent,House,2.0,3.0,Ask agent,0.3,3,1834
Hewetts Quay  Abbey Lane  Barking IG11,,1700,1961,Long term,Furnished,Ask agent,Apartment,,1.0,Ask agent,1.0,3,1835
"Botanic Square, Canary Wharf",,2817,0,Long term,Furnished,Ask agent,Flat,2.0,2.0,Ask agent,0.4,3,1836
"Jamestown Way, Canary Wharf",,2249,0,Long term,Unfurnished,Ask agent,Flat,2.0,2.0,Ask agent,0.3,3,1837
Doggett Road London SE6,,1850,0,Long term,Unfurnished,Ask agent,Flat,2.0,2.0,Ask agent,0.3,3,1838
"Belfort Road,  Nunhead, SE15",SE15,1550,0,Long term,Unfurnished,Ask agent,Flat,1.0,1.0,Ask agent,0.4,3,1839
"New Road, Rainham, Havering, London, RM13",RM13,2200,0,Long term,"Furnished or unfurnished, landlord is flexible",Ask agent,Ground Flat,3.0,,Ask agent,1.1,3,1840
"New Road, Rainham, Havering, London, RM13",RM13,1750,0,Long term,Ask agent,Ask agent,Apartment,2.0,,Ask agent,1.1,3,1841
"New Road, Rainham, Havering, London, RM13",RM13,2150,0,Long term,"Furnished or unfurnished, landlord is flexible",Ask agent,Ground Flat,3.0,,Ask agent,1.1,3,1842
"New Road, Rainham, Havering, London, RM13",RM13,2100,0,Long term,Ask agent,Ask agent,Ground Flat,3.0,,Ask agent,1.1,3,1843
"Westferry Road, London, Greater London. E14",,1750,2019,Long term,Furnished,Ask agent,Flat,1.0,1.0,Ask agent,0.5,3,1844
"Newham, E16 2Su, E16",E16,1950,1950,Long term,Furnished,Ask agent,Flat,1.0,1.0,Ask agent,0.4,3,1845
"John Cabot House, London, E16",E16,1200,1200,Long term,Furnished,Ask agent,Flat Share,1.0,2.0,Ask agent,0.4,3,1846
Upper Brockley Road London SE4,,2200,0,Long term,Furnished,Ask agent,Apartment,3.0,1.0,Ask agent,0.5,3,1847
"City Harbour, Selsdon Way, Canary Wharf, E14",E14,2450,0,Long term,Furnished,Ask agent,Apartment,2.0,2.0,Ask agent,0.2,3,1848
"Brigadier Walk, Royal Arsenal Riverside, SE18",SE18,2050,0,Long term,Furnished,Ask agent,Apartment,1.0,1.0,Ask agent,0.4,3,1849
"Wharf Lane, Limehouse",,2149,0,Long term,Furnished,Ask agent,Flat,2.0,2.0,775 sq ft,0.4,3,1850
"Lee High Road, London, SE13",SE13,775,894,Long term,"Furnished or unfurnished, landlord is flexible",Ask agent,House Share,1.0,2.0,Ask agent,0.6,3,1851
"Belgrave Court, 
36 Westferry Circus, E14",E14,3000,4154,Long term,Furnished,Ask agent,Flat,2.0,2.0,Ask agent,0.3,3,1852
Bermondsey Wall West Shad Thames SE16,,4225,0,Long term,"Furnished or unfurnished, landlord is flexible",Ask agent,Apartment,2.0,2.0,Ask agent,0.5,3,1853
Jenner Close Sidcup DA14,,1750,2019,Long term,Unfurnished,Ask agent,Flat,2.0,1.0,Ask agent,1.1,3,1854
"Stanstead Road,  London, SE23",SE23,2000,2307,Long term,Ask agent,Ask agent,Flat,2.0,2.0,Ask agent,0.6,3,1855
"Blenheim Grove, Peckham Rye, London, SE15",SE15,2500,0,Long term,Unfurnished,Ask agent,House,2.0,1.0,Ask agent,0.5,3,1856
"Cossall Walk, Queens Road , London, SE15",SE15,1450,0,Long term,Part furnished,Ask agent,Apartment,1.0,1.0,Ask agent,0.4,3,1857
"West Tower, Hoola, 1 Tidal Basin Road, London, E16",E16,2500,0,Long term,Furnished,Ask agent,Apartment,2.0,2.0,Ask agent,0.3,3,1858
"Riverscape, Royal Crest Avenue, E16",E16,2650,0,Long term,Furnished,Ask agent,Apartment,2.0,2.0,Ask agent,0.5,3,1859
"10 Marsh Wall, Landmark Pinnacle, E14",E14,3683,0,Long term,Furnished,Ask agent,Apartment,2.0,2.0,Ask agent,0.3,3,1860
"Drake Hall, Wesley Avenue, London, E16",E16,2100,2423,Long term,Ask agent,Ask agent,Apartment,2.0,1.0,Ask agent,0.3,3,1861
"Bellenden Road, London, Greater London, SE15 4BY",,2100,2423,Long term,Unfurnished,Ask agent,Apartment,1.0,1.0,Ask agent,0.5,3,1862
"Blenheim Court, King & Queen Wharf, SE16",SE16,1650,1904,Long term,Ask agent,Ask agent,Studio,,1.0,Ask agent,0.5,3,1863
"Darwin Road , Welling, Kent",Kent,2600,3000,Long term,Unfurnished,Ask agent,House,4.0,2.0,Ask agent,0.8,3,1864
"Bouchon Point, The Silk District, E1",,3198,0,Long term,Furnished,Ask agent,Apartment,2.0,2.0,Ask agent,0.4,3,1865
Brackley Road Beckenham BR3,,1650,1903,Long term,Unfurnished,Ask agent,Flat,2.0,1.0,Ask agent,0.4,3,1866
Williamsburg Plaza London E14,,2578,2975,Long term,Unfurnished,Ask agent,Flat,2.0,2.0,Ask agent,0.2,3,1867
"Leslie Road, Leyton",,1700,1961,Long term,"Furnished or unfurnished, landlord is flexible",Ask agent,Flat,2.0,1.0,Ask agent,0.5,3,1868
"Priory Road, London, E6",,2250,0,Long term,Furnished,Ask agent,Flat,2.0,2.0,888 sq ft,0.6,3,1869
Hanover Avenue West Silvertown E16,,1900,2192,Long term,Furnished,Ask agent,Terraced,2.0,1.0,Ask agent,0.2,3,1870
Providence Square Tower Bridge London SE1 2EB,,3500,4038,Long term,Unfurnished,Ask agent,Duplex,2.0,2.0,Ask agent,0.5,3,1871
"Denison House, 
20 Lanterns Way, E14",E14,2000,2308,Long term,Ask agent,Ask agent,Flat,1.0,1.0,Ask agent,0.3,3,1872
"Canberra Road, London, Greater London, SE7 8PE",,3200,3692,Long term,Unfurnished,Ask agent,Semi-Detached,3.0,3.0,Ask agent,0.8,3,1873
"Melon Road, Leytonstone",,1500,1731,Long term,Unfurnished,Ask agent,Apartment,1.0,,Ask agent,0.5,3,1874
"Swanbridge Road, DA7",DA7,1999,0,Long term,Ask agent,Ask agent,Bungalow,4.0,1.0,Ask agent,0.9,3,1875
"Cecil Avenue, Barking, Essex, IG11",IG11,800,800,Long term,"Furnished or unfurnished, landlord is flexible",Ask agent,House Share,1.0,1.0,Ask agent,0.8,3,1876
"One Park Drive, Canary Wharf, E14",E14,2383,2750,Long term,Furnished,Ask agent,Apartment,,1.0,Ask agent,0.2,3,1877
"Newport Avenue, London, Greater London. E14",,1725,1990,Long term,Furnished,Ask agent,Flat,1.0,1.0,Ask agent,0.3,3,1878
"Glenmore Road, Welling, DA16",DA16,1650,0,Long term,Ask agent,Ask agent,Semi-Detached,2.0,1.0,Ask agent,1.0,3,1879
"Chapel Road, Bexleyheath, Kent, DA7 4HN",,1800,2076,Long term,Furnished,Ask agent,Semi-Detached,2.0,1.0,Ask agent,0.9,3,1880
"Vancouver House, Maple Quays SE16",,2600,3000,Long term,Furnished,Ask agent,Apartment,2.0,2.0,724 sq ft,0.2,3,1881
"Crofton Road, London, E13",E13,875,875,Long term,Furnished,Ask agent,House Share,1.0,2.0,Ask agent,0.9,3,1882
"Landmark Pinnacle, London, E14",E14,3200,3692,Long term,Furnished,Ask agent,Flat,1.0,1.0,Ask agent,0.3,3,1883
"Bancroft Road, E1 4BU",,5500,6346,,Part furnished,Ask agent,House,6.0,2.0,Ask agent,0.4,3,1884
Eaglesfield Road London SE18,,1795,2070,Long term,Furnished,Ask agent,Flat,2.0,1.0,Ask agent,1.1,3,1885
"Johnson House, Bethnal Green, E2",,3050,3519,Long term,Furnished,Ask agent,Maisonette,3.0,1.0,Ask agent,0.4,3,1886
"Deauvile Close, London, E14",E14,1895,2187,Long term,Furnished,Ask agent,Flat,1.0,1.0,Ask agent,0.3,3,1887
"Orange Grove, London, E11",E11,1600,1846,Long term,Unfurnished,Ask agent,Flat,1.0,1.0,Ask agent,0.5,3,1888
"Landmark East Tower, London, E14",E14,2490,2873,Long term,Furnished,Ask agent,Flat,1.0,1.0,Ask agent,0.2,3,1889
"Porters Avenue, Dagenham, London, RM9",RM9,2100,2538,Long term,Unfurnished,Ask agent,Semi-Detached,3.0,,Ask agent,0.8,3,1890
"Paxton Point, 3 Merryweather Place, London, SE10",SE10,1750,2019,Long term,Furnished,Ask agent,Apartment,1.0,1.0,490 sq ft,0.3,3,1891
"The Sphere, Canning Town, London E16",,1733,0,Long term,Furnished,Ask agent,Apartment,1.0,1.0,Ask agent,0.3,3,1892
Cable Walk London SE10,,2600,3000,Long term,Furnished,Ask agent,Flat,2.0,2.0,Ask agent,0.6,3,1893
"Routh Street, Beckton, E6",,750,865,Long term,Furnished,Ask agent,House Share,1.0,1.0,Ask agent,0.4,3,1894
"Manhattan Loft Gardens, 20 International Way, London",,6800,7846,Long term,Furnished,Ask agent,Flat,2.0,3.0,Ask agent,0.5,3,1895
"Arbery Road, Bow, E3 5DF",,2800,3230,Long term,Part furnished,Ask agent,Duplex,3.0,2.0,915 sq ft,0.6,3,1896
Blondin Way London SE16,,2600,0,Long term,Furnished,Ask agent,Flat,2.0,2.0,Ask agent,0.7,3,1897
"Bostall Lane, London, SE2 0NH",,1850,2135,Long term,Unfurnished,Ask agent,Terraced,3.0,1.0,Ask agent,1.1,3,1898
"Katharine Court, E14",E14,1850,2134,Long term,Furnished,Ask agent,Flat,2.0,2.0,Ask agent,0.4,3,1899
Coral Apartments Salton Square E14,,2297,0,Long term,Part furnished,Ask agent,Apartment,3.0,1.0,Ask agent,0.4,3,1900
"Etchingham Road, Leyton, E15",E15,2450,0,Long term,Ask agent,Ask agent,,3.0,1.0,Ask agent,0.5,3,1901
"Altitude Point, Alie Street, Aldgate, London, E1",,3500,4038,Long term,Furnished,Ask agent,Flat,2.0,2.0,Ask agent,0.2,3,1902
"Poplar, London, E14",E14,2250,2500,,Furnished,Ask agent,Apartment,1.0,1.0,Ask agent,0.3,3,1903
"Arnold Estate, Druid Street, London, SE1",SE1,1800,0,Long term,Ask agent,Ask agent,Apartment,1.0,,Ask agent,0.6,3,1904
"Discovery Dock Apartments East, 3 South Quay Square, Nr Canary Wharf, London, E14",E14,2999,3460,Long term,Furnished,Ask agent,Flat,2.0,2.0,Ask agent,0.2,3,1905
"Charrington House,1 Cephas Avenue, London",,2100,2423,Long term,Furnished,Ask agent,Flat,2.0,1.0,Ask agent,0.4,3,1906
Waterline Way Surrey Quays SE8,,1800,2077,Long term,Furnished,Ask agent,Apartment,1.0,1.0,Ask agent,0.7,3,1907
"Plumstead Road, Woolwich, London, SE18",SE18,2000,2308,Long term,Part furnished,Ask agent,Flat,1.0,1.0,649 sq ft,0.3,3,1908
Lamb Court Narrow Street E14,,2197,0,Long term,Furnished,Ask agent,Flat,2.0,2.0,Ask agent,0.5,3,1909
"Sunderland Road, Forest Hill, SE23",SE23,2000,2307,Long term,"Furnished or unfurnished, landlord is flexible",Ask agent,Flat,3.0,1.0,Ask agent,0.7,3,1910
"Pepys Court 20 Love Lane, London",,1850,2134,Long term,Ask agent,Ask agent,Flat,2.0,1.0,Ask agent,0.3,3,1911
"Longbridge Road, Barking, London, IG11",IG11,1800,0,Long term,Ask agent,Ask agent,Flat,2.0,,Ask agent,0.9,3,1912
"Neutron Tower, 6 Blackwall Way, East India, London, E14 9GT",,1850,0,Long term,Furnished,Ask agent,Flat,1.0,,Ask agent,0.3,3,1913
"Cobham House, Kidbrook Village, London, SE3",SE3,1700,0,Long term,Unfurnished,Ask agent,Flat,1.0,1.0,Ask agent,0.7,3,1914
"Ontario Point, Surrey Quays Road, London, SE16",SE16,2300,2653,Long term,"Furnished or unfurnished, landlord is flexible",Ask agent,Apartment,1.0,1.0,627 sq ft,0.2,3,1915
"Aspen, Marsh Wall, E14",E14,3000,3462,Long term,Furnished,Ask agent,,1.0,1.0,Ask agent,0.1,3,1916
Creasey House,,3467,0,,Furnished,Ask agent,Flat,4.0,1.0,Ask agent,0.7,3,1917
"14 Chapman Apartments, Frogley Park, Barking IG11 0ZP",,1625,0,,Unfurnished,Ask agent,Flat,2.0,2.0,Ask agent,0.9,3,1918
"Breton house. St. Saviours Estate, London, SE1",SE1,1650,1903,Long term,Furnished,Ask agent,Apartment,1.0,1.0,Ask agent,0.7,3,1919
Conington Road Lewisham SE13,,1600,2019,Long term,Furnished,Ask agent,Flat,1.0,1.0,Ask agent,0.3,3,1920
"10 Forrester Way, Stratford",,2995,0,Long term,Furnished,Ask agent,Apartment,3.0,2.0,Ask agent,0.3,3,1921
"Giles House, 10 Forrester Way, Stratford",,3250,0,Long term,Furnished,Ask agent,Apartment,3.0,2.0,Ask agent,0.3,3,1922
"7 Crews Street, London",,2000,2307,Long term,Furnished,Ask agent,Apartment,1.0,1.0,584 sq ft,0.6,3,1923
"Britten Court, Abbey Lane, London, E15",E15,1550,1788,Long term,Part furnished,Ask agent,Apartment,1.0,1.0,Ask agent,0.4,3,1924
"Perilla House, Stable Walk, Aldgate, London, E1",,3700,4269,Long term,Furnished,Ask agent,Flat,2.0,2.0,Ask agent,0.3,3,1925
"Ward Road, Stratford",,2249,0,Long term,Furnished,Ask agent,Flat,2.0,2.0,Ask agent,0.3,3,1926
"Mercier Court, Royal Wharf, London, E16",E16,1998,0,Long term,Unfurnished,Ask agent,Apartment,1.0,1.0,Ask agent,0.4,3,1927
"Stable Walk, London, E1",,3850,4442,Long term,Furnished,Ask agent,Apartment,2.0,,Ask agent,0.3,3,1928
"New Cross Road, New Cross, SE14",SE14,2000,2307,Long term,Furnished,Ask agent,Maisonette,3.0,1.0,Ask agent,0.3,3,1929
"Copperfields, The Avenue, Beckenham, BR3",BR3,1900,2192,Long term,Unfurnished,Ask agent,Flat,2.0,2.0,Ask agent,0.6,3,1930
"Liner House, Royal Wharf, London, E16",E16,2050,0,Long term,Furnished,Ask agent,Apartment,1.0,1.0,Ask agent,0.5,3,1931
"Manhattan Loft Gardens, 20 International Way, London",,3200,3692,Long term,Furnished,Ask agent,Flat,1.0,1.0,Ask agent,0.5,3,1932
Abbeville Apartments Barking IG11,,1875,0,Long term,Furnished,Ask agent,Apartment,2.0,1.0,Ask agent,0.8,3,1933
"Skyline Apartments, 11 Makers Yard, London, E3",,2200,2538,Long term,Furnished,Ask agent,Apartment,1.0,1.0,Ask agent,0.4,3,1934
"Rowcross Street, Bermondsey",,1998,0,Long term,Furnished,Ask agent,Flat,2.0,1.0,Ask agent,1.0,3,1935
"Knox Road, London, E7",,3000,3461,Long term,Part furnished,Ask agent,Ground Flat,3.0,1.0,"1,200-1,300 sq ft",0.6,3,1936
"Grantham House, London City Island, E14",E14,2708,0,Long term,Furnished,Ask agent,Apartment,2.0,2.0,Ask agent,0.8,3,1937
"Ursula Gould Way, E14",E14,2250,2596,Long term,Furnished,Ask agent,Apartment,2.0,1.0,Ask agent,0.4,3,1938
"150 High Street, London, E15",E15,2000,2307,Long term,Furnished,Ask agent,Apartment,2.0,2.0,Ask agent,0.4,3,1939
"158 High Street, London, E15",E15,2325,2682,Long term,Furnished,Ask agent,Apartment,2.0,2.0,Ask agent,0.4,3,1940
"Little Heath Road, Bexleyheath, DA7",DA7,3350,3865,Long term,Part furnished,Ask agent,Semi-Detached,4.0,3.0,Ask agent,1.1,3,1941
"New Atlas Wharf, London E14",,2037,2350,Long term,Furnished,Ask agent,Flat,1.0,1.0,Ask agent,0.5,3,1942
"Abbey Street, London, SE16",SE16,2100,2423,Long term,Furnished,Ask agent,Apartment,1.0,1.0,Ask agent,0.6,3,1943
"Victoria Wharf, 46 Narrow Street, Nr Canary Wharf, London, E14",E14,2999,3460,Long term,Furnished,Ask agent,Flat,2.0,2.0,Ask agent,0.5,3,1944
"Baltimore Wharf, London, E14",E14,1690,1690,Long term,Part furnished,Ask agent,Apartment,1.0,1.0,Ask agent,0.3,3,1945
"Boardwalk Place, 
South Quay, E14",E14,2600,3000,Long term,Furnished,Ask agent,Flat,2.0,2.0,Ask agent,0.2,3,1946
"South Quay Square, Canary Wharf",,2999,3461,,Furnished,Ask agent,Apartment,2.0,2.0,Ask agent,0.1,3,1947
"Sterling Mansions, Leman Street, E1",,5997,0,Long term,Furnished,Ask agent,Apartment,3.0,2.0,Ask agent,0.2,3,1948
Palace View Bromley BR1,,2250,0,Long term,Unfurnished,Ask agent,End of Terrace,3.0,1.0,Ask agent,0.6,3,1949
"Skyline Apartments, Makers Yard, E3",,2200,0,Long term,Furnished,Ask agent,Apartment,1.0,1.0,Ask agent,0.4,3,1950
"Commercial Street, London, E1",,4350,5019,Long term,Furnished,Ask agent,Flat,2.0,2.0,Ask agent,0.3,3,1951
"Woodstock Terrace, London, E14",E14,1650,1904,Long term,Furnished,Ask agent,Flat,1.0,1.0,Ask agent,0.2,3,1952
"Hawstead Road, London, SE6",SE6,1500,1731,Long term,"Furnished or unfurnished, landlord is flexible",Ask agent,Flat,1.0,1.0,Ask agent,0.4,3,1953
"Fordham Street, London, E1",,2250,2250,Long term,Furnished,Ask agent,Flat,2.0,2.0,Ask agent,0.4,3,1954
"Madron Street, London, SE17",SE17,1750,1750,Long term,Unfurnished,Ask agent,Flat,1.0,1.0,Ask agent,1.0,3,1955
"Myers Lane, London, SE14",SE14,1500,1500,Long term,Furnished,Ask agent,Flat,1.0,1.0,Ask agent,0.6,3,1956
"Surrey Quays Road, London, SE16",SE16,2000,2307,Long term,Furnished,Ask agent,Apartment,1.0,1.0,517 sq ft,0.2,3,1957
"Manhattan Loft Gardens, 20 International Way, London",,2850,3288,Long term,Furnished,Ask agent,Flat,1.0,1.0,Ask agent,0.5,3,1958
"Manhattan Loft Gardens, 20 International Way, London",,2850,3288,Long term,Furnished,Ask agent,Apartment,1.0,1.0,Ask agent,0.5,3,1959
Mays Hill Road Shortlands BR2,,1950,0,Long term,Part furnished,Ask agent,Flat,2.0,2.0,Ask agent,0.6,3,1960
"Queens Road, Peckham, SE15",SE15,2250,0,Long term,Unfurnished,Ask agent,Apartment,2.0,2.0,Ask agent,0.4,3,1961
"Queens Road, Peckham, SE15",SE15,1850,0,Long term,Furnished,Ask agent,Apartment,1.0,1.0,Ask agent,0.4,3,1962
Tanner Street London SE1,,3200,3692,Long term,Furnished,Ask agent,Flat,2.0,2.0,Ask agent,0.6,3,1963
"Ottley Drive, London, SE3",SE3,1600,1846,Long term,Ask agent,Ask agent,Apartment,1.0,,Ask agent,0.7,3,1964
"Denison House, 
Lanterns Way, E14",E14,2200,2538,Long term,Furnished,Ask agent,Flat,1.0,1.0,480 sq ft,0.2,3,1965
